date;datetime;cash_type;coffee_name;amount_final
1/03/2024;2024-03-01 10:15:50.520;card;Latte;38,7
1/03/2024;2024-03-01 12:19:22.539;card;Hot Chocolate;38,7
1/03/2024;2024-03-01 12:20:18.089;card;Hot Chocolate;38,7
1/03/2024;2024-03-01 13:46:33.006;card;Americano;28,9
1/03/2024;2024-03-01 13:48:14.626;card;Latte;38,7
1/03/2024;2024-03-01 15:39:47.726;card;Americano with Milk;33,8
1/03/2024;2024-03-01 16:19:02.756;card;Hot Chocolate;38,7
1/03/2024;2024-03-01 18:39:03.580;card;Americano with Milk;33,8
1/03/2024;2024-03-01 19:22:01.762;card;Cocoa;38,7
1/03/2024;2024-03-01 19:23:15.887;card;Americano with Milk;33,8
1/03/2024;2024-03-01 19:29:17.391;card;Americano with Milk;33,8
2/03/2024;2024-03-02 10:22:06.957;card;Americano;28,9
2/03/2024;2024-03-02 10:30:35.668;cash;Latte;40
2/03/2024;2024-03-02 10:41:41.249;card;Americano with Milk;33,8
2/03/2024;2024-03-02 11:59:45.484;card;Americano with Milk;33,8
2/03/2024;2024-03-02 14:38:35.535;card;Americano;28,9
2/03/2024;2024-03-02 16:37:24.475;card;Americano with Milk;33,8
2/03/2024;2024-03-02 17:34:54.969;card;Americano;28,9
3/03/2024;2024-03-03 10:10:43.981;cash;Latte;40
3/03/2024;2024-03-03 10:27:18.561;card;Latte;38,7
3/03/2024;2024-03-03 11:33:56.118;card;Cortado;28,9
3/03/2024;2024-03-03 12:26:56.098;card;Americano;28,9
3/03/2024;2024-03-03 13:09:36.321;card;Hot Chocolate;38,7
3/03/2024;2024-03-03 17:06:40.271;card;Cocoa;38,7
3/03/2024;2024-03-03 17:08:45.895;card;Cortado;28,9
3/03/2024;2024-03-03 18:03:23.369;card;Americano with Milk;33,8
3/03/2024;2024-03-03 18:04:27.946;card;Americano with Milk;33,8
3/03/2024;2024-03-03 18:08:04.959;card;Hot Chocolate;38,7
4/03/2024;2024-03-04 10:03:51.994;card;Latte;38,7
4/03/2024;2024-03-04 10:54:50.958;card;Latte;38,7
4/03/2024;2024-03-04 11:05:16.184;card;Americano with Milk;33,8
4/03/2024;2024-03-04 14:04:37.734;card;Espresso;24
5/03/2024;2024-03-05 09:59:52.651;card;Latte;38,7
5/03/2024;2024-03-05 14:34:55.963;card;Latte;38,7
5/03/2024;2024-03-05 17:34:06.043;card;Latte;38,7
5/03/2024;2024-03-05 17:35:25.021;card;Hot Chocolate;38,7
5/03/2024;2024-03-05 17:36:28.571;card;Cocoa;38,7
5/03/2024;2024-03-05 17:37:13.659;card;Hot Chocolate;38,7
5/03/2024;2024-03-05 17:38:09.354;card;Hot Chocolate;38,7
5/03/2024;2024-03-05 17:56:15.776;card;Cortado;28,9
5/03/2024;2024-03-05 18:01:31.242;card;Hot Chocolate;38,7
6/03/2024;2024-03-06 12:30:27.089;cash;Americano with Milk;35
6/03/2024;2024-03-06 13:24:07.667;card;Americano;28,9
6/03/2024;2024-03-06 13:25:14.351;card;Cortado;28,9
6/03/2024;2024-03-06 14:52:01.761;card;Cappuccino;38,7
6/03/2024;2024-03-06 14:53:18.344;card;Cappuccino;38,7
7/03/2024;2024-03-07 10:08:58.945;cash;Latte;40
7/03/2024;2024-03-07 10:18:40.543;card;Hot Chocolate;38,7
7/03/2024;2024-03-07 11:03:58.976;card;Latte;38,7
7/03/2024;2024-03-07 11:25:43.977;cash;Latte;40
7/03/2024;2024-03-07 15:40:22.606;card;Americano;28,9
7/03/2024;2024-03-07 15:41:28.784;card;Americano with Milk;33,8
8/03/2024;2024-03-08 10:34:41.283;card;Cortado;28,9
8/03/2024;2024-03-08 12:22:28.653;card;Cappuccino;38,7
8/03/2024;2024-03-08 13:53:02.042;card;Americano;28,9
8/03/2024;2024-03-08 14:44:12.686;card;Americano;28,9
8/03/2024;2024-03-08 14:45:11.048;card;Americano;28,9
8/03/2024;2024-03-08 14:46:11.155;card;Americano with Milk;33,8
8/03/2024;2024-03-08 18:57:51.451;card;Latte;38,7
8/03/2024;2024-03-08 18:59:24.941;card;Latte;38,7
9/03/2024;2024-03-09 11:49:37.292;cash;Hot Chocolate;40
9/03/2024;2024-03-09 12:05:15.559;card;Espresso;24
9/03/2024;2024-03-09 12:07:38.275;card;Americano;28,9
9/03/2024;2024-03-09 12:09:47.714;card;Cappuccino;38,7
9/03/2024;2024-03-09 12:13:03.521;card;Americano;28,9
9/03/2024;2024-03-09 12:14:26.458;card;Americano;28,9
9/03/2024;2024-03-09 13:09:22.229;card;Latte;38,7
9/03/2024;2024-03-09 13:41:06.167;card;Americano with Milk;33,8
9/03/2024;2024-03-09 13:53:10.408;card;Cortado;28,9
9/03/2024;2024-03-09 13:54:36.828;card;Cappuccino;38,7
9/03/2024;2024-03-09 14:08:01.829;card;Americano with Milk;33,8
9/03/2024;2024-03-09 14:26:52.873;card;Hot Chocolate;38,7
9/03/2024;2024-03-09 19:17:57.572;card;Cappuccino;38,7
9/03/2024;2024-03-09 19:19:10.084;card;Hot Chocolate;38,7
10/03/2024;2024-03-10 07:44:18.538;cash;Americano;30
10/03/2024;2024-03-10 07:45:29.441;cash;Americano with Milk;35
10/03/2024;2024-03-10 10:06:02.960;cash;Latte;40
10/03/2024;2024-03-10 11:19:20.764;card;Espresso;24
10/03/2024;2024-03-10 17:51:03.048;cash;Americano with Milk;35
10/03/2024;2024-03-10 19:34:00.478;card;Latte;38,7
10/03/2024;2024-03-10 19:35:54.712;card;Cortado;28,9
11/03/2024;2024-03-11 10:18:46.724;cash;Latte;40
11/03/2024;2024-03-11 11:24:15.022;cash;Cappuccino;40
11/03/2024;2024-03-11 11:24:51.565;cash;Cortado;30
11/03/2024;2024-03-11 11:26:44.221;cash;Americano;30
11/03/2024;2024-03-11 11:32:58.781;card;Cappuccino;38,7
11/03/2024;2024-03-11 16:24:26.401;card;Americano;28,9
11/03/2024;2024-03-11 16:25:45.664;card;Latte;38,7
11/03/2024;2024-03-11 16:50:49.608;card;Cortado;28,9
12/03/2024;2024-03-12 10:15:00.297;cash;Latte;40
12/03/2024;2024-03-12 10:15:34.543;card;Americano;28,9
12/03/2024;2024-03-12 10:16:24.886;card;Cortado;28,9
12/03/2024;2024-03-12 11:20:45.632;card;Hot Chocolate;38,7
12/03/2024;2024-03-12 12:46:23.275;card;Americano with Milk;33,8
12/03/2024;2024-03-12 12:47:26.027;card;Americano;28,9
12/03/2024;2024-03-12 16:15:43.325;card;Americano;28,9
13/03/2024;2024-03-13 11:06:43.038;card;Hot Chocolate;38,7
13/03/2024;2024-03-13 11:48:16.753;card;Americano;28,9
13/03/2024;2024-03-13 12:18:06.336;card;Americano;28,9
13/03/2024;2024-03-13 12:19:05.128;card;Americano;28,9
13/03/2024;2024-03-13 12:34:30.315;cash;Espresso;25
13/03/2024;2024-03-13 14:26:40.875;card;Americano with Milk;33,8
13/03/2024;2024-03-13 15:40:22.261;card;Espresso;24
13/03/2024;2024-03-13 15:41:20.424;card;Espresso;24
13/03/2024;2024-03-13 16:47:09.373;card;Espresso;24
14/03/2024;2024-03-14 10:02:12.241;cash;Latte;40
14/03/2024;2024-03-14 10:28:33.017;card;Latte;38,7
14/03/2024;2024-03-14 10:29:34.283;card;Hot Chocolate;38,7
14/03/2024;2024-03-14 13:27:29.536;card;Cortado;28,9
14/03/2024;2024-03-14 13:28:24.527;card;Americano;28,9
14/03/2024;2024-03-14 13:51:59.905;card;Americano with Milk;33,8
14/03/2024;2024-03-14 13:52:56.248;card;Espresso;24
14/03/2024;2024-03-14 15:20:38.367;card;Latte;38,7
14/03/2024;2024-03-14 16:04:09.506;card;Americano with Milk;33,8
14/03/2024;2024-03-14 16:54:38.202;card;Espresso;24
14/03/2024;2024-03-14 18:58:55.854;card;Hot Chocolate;38,7
14/03/2024;2024-03-14 19:00:08.663;card;Cortado;28,9
15/03/2024;2024-03-15 10:02:16.533;cash;Latte;40
15/03/2024;2024-03-15 10:53:02.180;card;Hot Chocolate;38,7
15/03/2024;2024-03-15 18:19:27.922;card;Americano;28,9
16/03/2024;2024-03-16 12:06:55.209;card;Americano with Milk;33,8
16/03/2024;2024-03-16 12:07:53.915;card;Americano;28,9
16/03/2024;2024-03-16 15:58:18.458;card;Cortado;28,9
16/03/2024;2024-03-16 16:03:21.738;card;Cortado;28,9
16/03/2024;2024-03-16 16:04:11.444;card;Cortado;28,9
16/03/2024;2024-03-16 17:58:07.241;card;Americano with Milk;33,8
17/03/2024;2024-03-17 10:10:21.399;cash;Latte;40
17/03/2024;2024-03-17 12:55:26.065;card;Cortado;28,9
18/03/2024;2024-03-18 11:17:59.671;card;Cortado;28,9
18/03/2024;2024-03-18 15:31:39.725;card;Americano;28,9
18/03/2024;2024-03-18 15:32:38.239;card;Americano;28,9
18/03/2024;2024-03-18 15:33:36.708;card;Americano;28,9
19/03/2024;2024-03-19 10:20:25.996;cash;Cortado;30
19/03/2024;2024-03-19 14:02:21.536;card;Latte;38,7
19/03/2024;2024-03-19 14:03:19.765;card;Latte;38,7
19/03/2024;2024-03-19 15:04:36.309;card;Hot Chocolate;38,7
19/03/2024;2024-03-19 16:53:48.706;card;Americano with Milk;33,8
19/03/2024;2024-03-19 19:26:32.677;cash;Hot Chocolate;40
20/03/2024;2024-03-20 11:41:16.403;card;Cortado;28,9
20/03/2024;2024-03-20 12:21:07.728;cash;Latte;40
20/03/2024;2024-03-20 12:30:48.968;card;Cortado;28,9
20/03/2024;2024-03-20 13:16:47.394;card;Cappuccino;38,7
20/03/2024;2024-03-20 16:42:38.117;card;Cocoa;38,7
20/03/2024;2024-03-20 17:50:28.781;card;Latte;38,7
21/03/2024;2024-03-21 10:18:56.977;cash;Cappuccino;40
21/03/2024;2024-03-21 12:25:09.194;card;Cortado;28,9
21/03/2024;2024-03-21 12:26:17.428;card;Cappuccino;38,7
21/03/2024;2024-03-21 17:21:01.453;cash;Americano;30
21/03/2024;2024-03-21 17:22:01.353;card;Cortado;28,9
21/03/2024;2024-03-21 19:20:36.508;card;Latte;38,7
22/03/2024;2024-03-22 10:35:53.619;card;Americano with Milk;33,8
22/03/2024;2024-03-22 13:29:20.343;card;Americano with Milk;33,8
22/03/2024;2024-03-22 16:15:14.448;cash;Cappuccino;40
22/03/2024;2024-03-22 17:17:03.724;card;Americano;28,9
22/03/2024;2024-03-22 17:17:58.991;card;Espresso;24
22/03/2024;2024-03-22 17:20:49.490;card;Americano;28,9
23/03/2024;2024-03-23 10:43:59.559;card;Latte;38,7
23/03/2024;2024-03-23 10:45:07.157;card;Americano with Milk;33,8
23/03/2024;2024-03-23 13:10:07.661;card;Cappuccino;38,7
23/03/2024;2024-03-23 13:11:12.230;card;Cocoa;38,7
23/03/2024;2024-03-23 14:44:41.276;card;Americano with Milk;33,8
23/03/2024;2024-03-23 15:47:19.062;card;Latte;38,7
23/03/2024;2024-03-23 15:49:33.813;card;Americano with Milk;33,8
23/03/2024;2024-03-23 16:00:58.386;card;Cortado;28,9
24/03/2024;2024-03-24 10:03:56.005;cash;Latte;40
24/03/2024;2024-03-24 18:45:08.397;card;Latte;38,7
25/03/2024;2024-03-25 10:31:47.250;card;Latte;38,7
25/03/2024;2024-03-25 11:16:25.671;cash;Americano with Milk;35
25/03/2024;2024-03-25 14:27:09.163;card;Latte;38,7
25/03/2024;2024-03-25 14:29:25.343;card;Latte;38,7
25/03/2024;2024-03-25 18:37:30.650;card;Americano with Milk;33,8
25/03/2024;2024-03-25 19:34:24.542;card;Cappuccino;38,7
26/03/2024;2024-03-26 10:35:49.679;card;Cocoa;38,7
26/03/2024;2024-03-26 10:36:36.151;card;Latte;38,7
26/03/2024;2024-03-26 10:42:30.170;card;Latte;38,7
26/03/2024;2024-03-26 11:11:47.335;card;Cortado;28,9
26/03/2024;2024-03-26 13:35:52.773;card;Americano;28,9
26/03/2024;2024-03-26 13:36:49.644;card;Cortado;28,9
26/03/2024;2024-03-26 13:37:59.723;card;Cortado;28,9
26/03/2024;2024-03-26 13:57:53.677;card;Americano;28,9
26/03/2024;2024-03-26 15:48:02.270;card;Latte;38,7
26/03/2024;2024-03-26 18:33:38.568;card;Latte;38,7
26/03/2024;2024-03-26 18:34:54.648;card;Hot Chocolate;38,7
27/03/2024;2024-03-27 11:04:51.174;card;Cortado;28,9
27/03/2024;2024-03-27 11:05:58.236;card;Americano with Milk;33,8
27/03/2024;2024-03-27 12:57:00.462;card;Americano with Milk;33,8
27/03/2024;2024-03-27 13:35:20.039;card;Hot Chocolate;38,7
27/03/2024;2024-03-27 14:22:31.662;card;Cappuccino;38,7
27/03/2024;2024-03-27 14:23:35.380;card;Americano;28,9
27/03/2024;2024-03-27 18:30:11.833;card;Cortado;28,9
27/03/2024;2024-03-27 19:31:12.442;cash;Latte;40
28/03/2024;2024-03-28 14:24:47.092;card;Cortado;28,9
28/03/2024;2024-03-28 17:24:46.244;card;Cortado;28,9
28/03/2024;2024-03-28 17:27:05.304;card;Americano;28,9
28/03/2024;2024-03-28 17:32:44.652;card;Latte;38,7
29/03/2024;2024-03-29 10:56:19.495;card;Latte;38,7
29/03/2024;2024-03-29 12:34:17.383;card;Cappuccino;38,7
29/03/2024;2024-03-29 12:41:32.125;card;Cappuccino;38,7
29/03/2024;2024-03-29 13:22:44.618;cash;Cappuccino;40
30/03/2024;2024-03-30 11:59:19.854;card;Latte;38,7
30/03/2024;2024-03-30 13:49:25.815;cash;Cappuccino;40
30/03/2024;2024-03-30 16:12:31.786;card;Latte;38,7
30/03/2024;2024-03-30 16:36:40.513;card;Latte;38,7
30/03/2024;2024-03-30 16:37:57.553;card;Americano with Milk;33,8
31/03/2024;2024-03-31 10:40:04.523;card;Cappuccino;38,7
31/03/2024;2024-03-31 19:36:45.000;cash;Americano;30
1/04/2024;2024-04-01 10:28:47.601;card;Americano;28,9
1/04/2024;2024-04-01 10:29:42.318;card;Americano with Milk;33,8
1/04/2024;2024-04-01 10:30:43.735;card;Americano with Milk;33,8
1/04/2024;2024-04-01 11:15:43.836;card;Americano with Milk;33,8
1/04/2024;2024-04-01 17:01:42.924;cash;Cappuccino;40
1/04/2024;2024-04-01 18:18:42.372;card;Americano with Milk;33,8
1/04/2024;2024-04-01 18:45:27.436;card;Hot Chocolate;38,7
2/04/2024;2024-04-02 10:01:14.022;card;Latte;38,7
2/04/2024;2024-04-02 16:18:34.169;card;Americano;28,9
2/04/2024;2024-04-02 16:19:28.460;card;Cortado;28,9
2/04/2024;2024-04-02 19:59:31.942;cash;Cappuccino;40
3/04/2024;2024-04-03 10:19:13.644;card;Cortado;28,9
3/04/2024;2024-04-03 10:20:07.655;card;Americano;28,9
3/04/2024;2024-04-03 13:12:05.367;card;Cappuccino;38,7
3/04/2024;2024-04-03 15:36:11.735;cash;Cortado;30
4/04/2024;2024-04-04 10:44:55.988;card;Latte;38,7
4/04/2024;2024-04-04 11:26:38.085;card;Latte;38,7
4/04/2024;2024-04-04 11:27:48.411;card;Cappuccino;38,7
4/04/2024;2024-04-04 12:23:02.216;card;Cortado;28,9
4/04/2024;2024-04-04 19:42:07.740;cash;Latte;40
5/04/2024;2024-04-05 10:40:42.728;card;Americano;28,9
5/04/2024;2024-04-05 10:42:06.204;card;Americano;28,9
5/04/2024;2024-04-05 11:06:14.643;card;Cortado;28,9
5/04/2024;2024-04-05 12:14:27.975;card;Americano with Milk;33,8
5/04/2024;2024-04-05 14:23:40.387;card;Latte;38,7
5/04/2024;2024-04-05 14:24:50.417;card;Cortado;28,9
5/04/2024;2024-04-05 15:30:50.383;cash;Latte;40
5/04/2024;2024-04-05 15:54:15.768;cash;Cappuccino;40
5/04/2024;2024-04-05 15:55:30.947;cash;Americano;30
5/04/2024;2024-04-05 16:17:43.975;cash;Cocoa;40
5/04/2024;2024-04-05 16:18:23.558;card;Espresso;24
6/04/2024;2024-04-06 12:32:31.398;card;Americano with Milk;33,8
6/04/2024;2024-04-06 14:13:18.733;card;Cappuccino;38,7
6/04/2024;2024-04-06 14:14:27.029;card;Americano;28,9
6/04/2024;2024-04-06 14:49:50.183;card;Latte;38,7
7/04/2024;2024-04-07 10:12:53.204;card;Latte;38,7
7/04/2024;2024-04-07 12:44:31.936;card;Cappuccino;38,7
7/04/2024;2024-04-07 12:46:05.118;card;Cappuccino;38,7
7/04/2024;2024-04-07 14:16:24.949;card;Cortado;28,9
7/04/2024;2024-04-07 14:17:30.628;card;Espresso;24
7/04/2024;2024-04-07 18:01:16.608;card;Hot Chocolate;38,7
7/04/2024;2024-04-07 18:02:03.878;card;Americano with Milk;33,8
8/04/2024;2024-04-08 10:58:21.106;card;Americano with Milk;33,8
8/04/2024;2024-04-08 10:59:27.558;card;Cappuccino;38,7
8/04/2024;2024-04-08 11:01:20.464;card;Americano;28,9
8/04/2024;2024-04-08 11:04:47.030;card;Cappuccino;38,7
8/04/2024;2024-04-08 12:54:25.897;cash;Espresso;25
8/04/2024;2024-04-08 15:43:36.881;cash;Americano with Milk;35
8/04/2024;2024-04-08 16:41:37.806;card;Latte;38,7
8/04/2024;2024-04-08 18:18:09.713;card;Americano;28,9
8/04/2024;2024-04-08 19:22:27.477;card;Americano with Milk;33,8
8/04/2024;2024-04-08 19:23:59.268;card;Cappuccino;38,7
9/04/2024;2024-04-09 10:22:27.359;cash;Cappuccino;40
9/04/2024;2024-04-09 10:24:10.103;cash;Americano;30
9/04/2024;2024-04-09 11:42:28.468;card;Latte;38,7
9/04/2024;2024-04-09 15:11:48.720;card;Hot Chocolate;38,7
9/04/2024;2024-04-09 17:25:23.936;card;Hot Chocolate;38,7
10/04/2024;2024-04-10 10:21:26.175;cash;Espresso;25
10/04/2024;2024-04-10 17:55:07.018;cash;Hot Chocolate;40
10/04/2024;2024-04-10 17:55:31.244;card;Espresso;24
10/04/2024;2024-04-10 18:24:59.290;card;Cappuccino;38,7
10/04/2024;2024-04-10 20:04:05.386;card;Latte;38,7
11/04/2024;2024-04-11 10:41:23.155;card;Americano;28,9
11/04/2024;2024-04-11 10:42:59.365;card;Americano;28,9
11/04/2024;2024-04-11 16:35:23.069;card;Latte;38,7
11/04/2024;2024-04-11 19:16:56.588;card;Cappuccino;38,7
11/04/2024;2024-04-11 19:18:36.619;card;Americano with Milk;33,8
12/04/2024;2024-04-12 19:03:43.403;card;Hot Chocolate;38,7
12/04/2024;2024-04-12 19:38:23.189;card;Cortado;28,9
13/04/2024;2024-04-13 12:29:19.823;card;Latte;38,7
13/04/2024;2024-04-13 12:43:02.389;card;Americano;28,9
13/04/2024;2024-04-13 15:06:52.292;cash;Hot Chocolate;40
13/04/2024;2024-04-13 15:07:55.966;cash;Hot Chocolate;40
13/04/2024;2024-04-13 16:18:03.938;card;Cappuccino;38,7
13/04/2024;2024-04-13 16:19:39.799;card;Latte;38,7
13/04/2024;2024-04-13 17:51:26.026;card;Cappuccino;38,7
13/04/2024;2024-04-13 17:53:19.237;card;Cappuccino;38,7
14/04/2024;2024-04-14 10:55:27.406;cash;Latte;40
14/04/2024;2024-04-14 12:24:39.028;card;Cappuccino;38,7
14/04/2024;2024-04-14 12:27:08.951;cash;Cortado;30
14/04/2024;2024-04-14 12:29:06.877;cash;Cortado;30
14/04/2024;2024-04-14 12:31:36.036;cash;Americano with Milk;35
14/04/2024;2024-04-14 13:21:49.808;card;Cortado;28,9
14/04/2024;2024-04-14 14:23:31.631;card;Americano;28,9
14/04/2024;2024-04-14 14:24:26.930;card;Americano;28,9
14/04/2024;2024-04-14 14:25:18.122;card;Americano;28,9
14/04/2024;2024-04-14 15:46:27.733;card;Cappuccino;38,7
14/04/2024;2024-04-14 16:59:54.823;card;Cortado;28,9
14/04/2024;2024-04-14 17:00:45.387;card;Latte;38,7
14/04/2024;2024-04-14 18:38:19.649;card;Cappuccino;38,7
15/04/2024;2024-04-15 11:45:24.619;card;Americano;28,9
15/04/2024;2024-04-15 17:01:46.359;card;Americano;28,9
15/04/2024;2024-04-15 17:02:49.748;card;Americano with Milk;33,8
15/04/2024;2024-04-15 19:33:03.036;card;Americano with Milk;33,8
15/04/2024;2024-04-15 19:41:58.112;cash;Espresso;25
16/04/2024;2024-04-16 10:43:49.907;cash;Americano with Milk;35
16/04/2024;2024-04-16 10:46:25.706;card;Americano with Milk;33,8
16/04/2024;2024-04-16 12:40:47.675;card;Cocoa;38,7
16/04/2024;2024-04-16 12:52:07.750;card;Cortado;28,9
16/04/2024;2024-04-16 15:03:16.889;card;Americano;28,9
16/04/2024;2024-04-16 17:42:04.208;card;Americano with Milk;33,8
16/04/2024;2024-04-16 17:43:22.960;card;Cappuccino;38,7
16/04/2024;2024-04-16 18:09:05.273;card;Cocoa;38,7
17/04/2024;2024-04-17 13:32:59.792;card;Americano;28,9
17/04/2024;2024-04-17 13:44:00.181;card;Espresso;24
17/04/2024;2024-04-17 16:13:24.310;cash;Cappuccino;40
17/04/2024;2024-04-17 17:01:35.149;card;Cappuccino;38,7
17/04/2024;2024-04-17 17:02:40.687;card;Cappuccino;38,7
17/04/2024;2024-04-17 18:14:03.229;card;Cortado;28,9
18/04/2024;2024-04-18 11:19:01.693;card;Americano;28,9
18/04/2024;2024-04-18 11:20:05.696;card;Americano;28,9
18/04/2024;2024-04-18 13:49:12.720;card;Americano with Milk;33,8
18/04/2024;2024-04-18 13:50:17.285;card;Cortado;28,9
18/04/2024;2024-04-18 14:34:19.818;card;Cappuccino;38,7
18/04/2024;2024-04-18 14:35:49.354;card;Latte;38,7
18/04/2024;2024-04-18 17:44:15.791;card;Latte;38,7
18/04/2024;2024-04-18 18:21:05.945;card;Cappuccino;38,7
18/04/2024;2024-04-18 19:39:51.193;card;Hot Chocolate;38,7
18/04/2024;2024-04-18 19:40:48.954;card;Hot Chocolate;38,7
19/04/2024;2024-04-19 10:10:36.254;card;Latte;38,7
19/04/2024;2024-04-19 13:11:47.848;card;Americano with Milk;33,8
19/04/2024;2024-04-19 13:13:20.876;card;Cappuccino;38,7
19/04/2024;2024-04-19 13:58:54.064;card;Hot Chocolate;38,7
19/04/2024;2024-04-19 13:59:49.690;card;Cappuccino;38,7
19/04/2024;2024-04-19 18:23:19.311;card;Cocoa;38,7
19/04/2024;2024-04-19 18:25:33.440;card;Americano with Milk;33,8
20/04/2024;2024-04-20 11:24:42.681;cash;Americano with Milk;35
20/04/2024;2024-04-20 12:08:35.701;card;Americano with Milk;33,8
20/04/2024;2024-04-20 12:09:42.664;card;Americano with Milk;33,8
20/04/2024;2024-04-20 13:08:37.378;card;Americano;28,9
20/04/2024;2024-04-20 13:09:47.905;card;Americano with Milk;33,8
20/04/2024;2024-04-20 13:10:55.151;card;Hot Chocolate;38,7
20/04/2024;2024-04-20 14:44:18.118;card;Cappuccino;38,7
20/04/2024;2024-04-20 15:11:00.330;card;Americano with Milk;33,8
20/04/2024;2024-04-20 15:22:40.717;card;Americano with Milk;32,82
20/04/2024;2024-04-20 15:49:25.148;card;Americano with Milk;32,82
20/04/2024;2024-04-20 17:07:57.969;cash;Cocoa;39
20/04/2024;2024-04-20 18:27:41.496;card;Cappuccino;37,72
20/04/2024;2024-04-20 18:28:46.900;card;Cappuccino;37,72
20/04/2024;2024-04-20 19:30:55.317;card;Latte;37,72
21/04/2024;2024-04-21 11:16:45.707;card;Latte;37,72
21/04/2024;2024-04-21 14:15:37.541;card;Americano;27,92
21/04/2024;2024-04-21 17:09:03.199;cash;Cappuccino;39
22/04/2024;2024-04-22 11:09:16.412;card;Americano;27,92
22/04/2024;2024-04-22 11:29:27.099;card;Americano with Milk;32,82
22/04/2024;2024-04-22 18:40:33.024;cash;Latte;39
22/04/2024;2024-04-22 19:39:04.759;card;Latte;37,72
22/04/2024;2024-04-22 20:02:29.165;cash;Cappuccino;39
23/04/2024;2024-04-23 14:22:35.995;card;Cappuccino;37,72
23/04/2024;2024-04-23 14:23:53.144;card;Americano with Milk;32,82
23/04/2024;2024-04-23 14:24:57.515;card;Cappuccino;37,72
23/04/2024;2024-04-23 19:42:27.765;card;Americano with Milk;32,82
23/04/2024;2024-04-23 19:43:26.234;card;Americano with Milk;32,82
24/04/2024;2024-04-24 10:19:38.346;card;Latte;37,72
24/04/2024;2024-04-24 10:21:27.287;card;Americano with Milk;32,82
24/04/2024;2024-04-24 11:23:46.102;card;Americano with Milk;32,82
24/04/2024;2024-04-24 11:33:26.347;card;Americano with Milk;32,82
24/04/2024;2024-04-24 12:39:09.298;card;Americano with Milk;32,82
24/04/2024;2024-04-24 16:39:07.423;card;Americano with Milk;32,82
24/04/2024;2024-04-24 19:39:49.983;card;Americano with Milk;32,82
24/04/2024;2024-04-24 19:40:54.031;card;Cappuccino;37,72
25/04/2024;2024-04-25 10:46:08.057;card;Americano;27,92
25/04/2024;2024-04-25 15:18:26.971;card;Latte;37,72
25/04/2024;2024-04-25 17:09:43.534;card;Americano;27,92
25/04/2024;2024-04-25 17:10:49.153;card;Americano;27,92
26/04/2024;2024-04-26 10:12:50.618;card;Latte;37,72
26/04/2024;2024-04-26 12:01:30.580;card;Latte;37,72
26/04/2024;2024-04-26 13:31:28.297;card;Cappuccino;37,72
26/04/2024;2024-04-26 15:32:35.390;card;Americano;27,92
26/04/2024;2024-04-26 15:33:33.132;card;Americano;27,92
26/04/2024;2024-04-26 16:23:26.514;card;Cortado;27,92
26/04/2024;2024-04-26 16:24:33.800;card;Americano;27,92
26/04/2024;2024-04-26 19:32:07.112;card;Hot Chocolate;37,72
26/04/2024;2024-04-26 19:33:30.220;card;Cocoa;37,72
27/04/2024;2024-04-27 15:27:00.680;card;Cappuccino;37,72
28/04/2024;2024-04-28 10:32:52.479;card;Latte;37,72
28/04/2024;2024-04-28 12:30:09.749;card;Cappuccino;37,72
28/04/2024;2024-04-28 18:27:08.230;card;Americano;27,92
28/04/2024;2024-04-28 18:28:11.411;card;Americano;27,92
28/04/2024;2024-04-28 18:29:02.374;card;Latte;37,72
29/04/2024;2024-04-29 11:26:31.871;card;Cortado;27,92
29/04/2024;2024-04-29 13:27:56.949;card;Americano;27,92
29/04/2024;2024-04-29 13:28:53.899;card;Cortado;27,92
29/04/2024;2024-04-29 13:53:35.730;card;Cortado;27,92
29/04/2024;2024-04-29 13:54:24.357;card;Americano with Milk;32,82
29/04/2024;2024-04-29 18:37:48.406;card;Cappuccino;37,72
29/04/2024;2024-04-29 19:12:33.194;card;Cappuccino;37,72
29/04/2024;2024-04-29 19:13:37.878;card;Cappuccino;37,72
30/04/2024;2024-04-30 10:16:41.493;card;Latte;37,72
30/04/2024;2024-04-30 10:34:52.250;card;Americano with Milk;32,82
30/04/2024;2024-04-30 10:35:47.617;card;Americano with Milk;32,82
30/04/2024;2024-04-30 13:41:52.325;card;Americano;27,92
30/04/2024;2024-04-30 13:42:59.977;card;Americano with Milk;32,82
30/04/2024;2024-04-30 19:19:18.139;card;Cappuccino;37,72
30/04/2024;2024-04-30 19:30:04.003;card;Americano with Milk;32,82
30/04/2024;2024-04-30 19:31:20.952;card;Latte;37,72
2/05/2024;2024-05-02 10:33:55.746;card;Americano;27,92
2/05/2024;2024-05-02 11:29:57.080;cash;Latte;39
2/05/2024;2024-05-02 13:49:39.898;card;Americano with Milk;32,82
2/05/2024;2024-05-02 18:36:22.138;card;Cappuccino;37,72
2/05/2024;2024-05-02 18:41:11.220;card;Americano with Milk;32,82
2/05/2024;2024-05-02 19:18:33.084;card;Latte;37,72
2/05/2024;2024-05-02 19:19:56.359;card;Cappuccino;37,72
3/05/2024;2024-05-03 10:11:53.399;cash;Latte;39
3/05/2024;2024-05-03 14:30:00.923;card;Latte;37,72
3/05/2024;2024-05-03 17:03:24.905;card;Latte;37,72
6/05/2024;2024-05-06 10:05:17.920;card;Americano;27,92
6/05/2024;2024-05-06 10:06:51.625;card;Cappuccino;37,72
6/05/2024;2024-05-06 10:08:05.863;card;Americano with Milk;32,82
6/05/2024;2024-05-06 10:09:07.977;card;Americano;27,92
6/05/2024;2024-05-06 10:39:12.641;card;Cortado;27,92
6/05/2024;2024-05-06 11:34:20.640;cash;Americano;29
6/05/2024;2024-05-06 13:18:10.990;card;Cortado;27,92
6/05/2024;2024-05-06 13:19:00.811;card;Americano;27,92
6/05/2024;2024-05-06 19:18:12.989;card;Cappuccino;37,72
6/05/2024;2024-05-06 19:19:49.548;card;Cappuccino;37,72
7/05/2024;2024-05-07 10:44:55.582;card;Cocoa;37,72
7/05/2024;2024-05-07 11:21:58.493;card;Cortado;27,92
7/05/2024;2024-05-07 13:23:34.943;card;Cortado;27,92
7/05/2024;2024-05-07 16:42:07.900;card;Cocoa;37,72
7/05/2024;2024-05-07 16:55:38.805;card;Americano;27,92
7/05/2024;2024-05-07 17:37:46.412;card;Cappuccino;37,72
7/05/2024;2024-05-07 17:38:48.195;card;Latte;37,72
7/05/2024;2024-05-07 18:35:37.235;cash;Americano with Milk;34
7/05/2024;2024-05-07 19:12:12.524;card;Cappuccino;37,72
7/05/2024;2024-05-07 19:13:12.195;card;Cappuccino;37,72
8/05/2024;2024-05-08 10:07:28.863;card;Latte;37,72
9/05/2024;2024-05-09 12:54:21.812;card;Cappuccino;37,72
9/05/2024;2024-05-09 13:03:58.556;card;Americano;27,92
9/05/2024;2024-05-09 13:04:57.647;card;Latte;37,72
9/05/2024;2024-05-09 13:06:11.261;card;Latte;37,72
9/05/2024;2024-05-09 13:07:16.409;card;Latte;37,72
9/05/2024;2024-05-09 16:55:14.601;card;Americano;27,92
9/05/2024;2024-05-09 16:56:14.989;card;Americano;27,92
9/05/2024;2024-05-09 18:01:29.895;card;Americano;27,92
9/05/2024;2024-05-09 18:13:56.226;card;Americano with Milk;32,82
10/05/2024;2024-05-10 10:09:21.972;cash;Latte;39
10/05/2024;2024-05-10 15:46:21.511;card;Latte;37,72
10/05/2024;2024-05-10 15:47:32.508;card;Latte;37,72
10/05/2024;2024-05-10 16:20:15.084;cash;Americano with Milk;34
11/05/2024;2024-05-11 11:39:52.878;card;Latte;37,72
11/05/2024;2024-05-11 17:02:43.648;cash;Latte;39
11/05/2024;2024-05-11 17:20:30.398;card;Americano with Milk;32,82
11/05/2024;2024-05-11 17:21:56.117;card;Cocoa;37,72
11/05/2024;2024-05-11 17:23:57.301;card;Cappuccino;37,72
11/05/2024;2024-05-11 17:28:54.132;card;Americano with Milk;32,82
11/05/2024;2024-05-11 18:35:40.257;card;Cappuccino;37,72
11/05/2024;2024-05-11 19:38:16.096;card;Latte;37,72
12/05/2024;2024-05-12 10:20:42.512;card;Latte;37,72
12/05/2024;2024-05-12 13:24:03.465;card;Latte;37,72
12/05/2024;2024-05-12 13:27:39.043;card;Americano;27,92
12/05/2024;2024-05-12 15:16:19.815;card;Latte;37,72
12/05/2024;2024-05-12 15:38:02.422;card;Americano with Milk;32,82
12/05/2024;2024-05-12 15:52:14.871;card;Americano with Milk;32,82
12/05/2024;2024-05-12 16:04:21.133;card;Americano with Milk;32,82
12/05/2024;2024-05-12 19:41:30.569;card;Americano with Milk;32,82
13/05/2024;2024-05-13 11:03:53.348;card;Americano with Milk;32,82
13/05/2024;2024-05-13 15:31:10.763;cash;Americano;29
13/05/2024;2024-05-13 15:31:50.907;cash;Americano;29
14/05/2024;2024-05-14 08:38:14.581;card;Americano;27,92
14/05/2024;2024-05-14 08:39:25.455;card;Americano;27,92
14/05/2024;2024-05-14 08:40:17.484;card;Americano;27,92
14/05/2024;2024-05-14 10:19:23.174;card;Cappuccino;37,72
14/05/2024;2024-05-14 11:32:29.372;card;Latte;37,72
14/05/2024;2024-05-14 11:34:12.851;card;Cappuccino;37,72
14/05/2024;2024-05-14 14:04:54.580;card;Cappuccino;37,72
14/05/2024;2024-05-14 14:06:00.378;card;Americano with Milk;32,82
14/05/2024;2024-05-14 15:01:54.785;card;Americano;27,92
14/05/2024;2024-05-14 16:57:57.224;card;Americano with Milk;32,82
14/05/2024;2024-05-14 16:59:10.194;card;Cappuccino;37,72
14/05/2024;2024-05-14 22:51:25.227;card;Hot Chocolate;37,72
15/05/2024;2024-05-15 08:40:05.661;card;Latte;37,72
15/05/2024;2024-05-15 11:14:19.353;card;Espresso;23,02
15/05/2024;2024-05-15 11:19:10.049;card;Americano;27,92
15/05/2024;2024-05-15 13:34:35.102;card;Americano;27,92
15/05/2024;2024-05-15 13:35:29.171;card;Americano;27,92
15/05/2024;2024-05-15 13:36:27.339;card;Americano;27,92
15/05/2024;2024-05-15 13:55:28.999;card;Americano with Milk;32,82
15/05/2024;2024-05-15 14:38:10.847;cash;Americano;29
15/05/2024;2024-05-15 14:38:52.347;card;Cortado;27,92
15/05/2024;2024-05-15 14:39:44.367;card;Cortado;27,92
15/05/2024;2024-05-15 17:28:58.620;card;Espresso;23,02
15/05/2024;2024-05-15 20:20:34.769;card;Cappuccino;37,72
16/05/2024;2024-05-16 10:38:42.458;card;Americano with Milk;32,82
16/05/2024;2024-05-16 10:39:49.431;card;Americano with Milk;32,82
16/05/2024;2024-05-16 11:42:50.285;cash;Latte;39
16/05/2024;2024-05-16 11:44:20.811;cash;Cappuccino;39
16/05/2024;2024-05-16 12:14:00.097;card;Americano with Milk;32,82
16/05/2024;2024-05-16 15:15:16.315;card;Hot Chocolate;37,72
16/05/2024;2024-05-16 17:44:31.548;card;Latte;37,72
16/05/2024;2024-05-16 18:12:56.934;card;Hot Chocolate;37,72
16/05/2024;2024-05-16 18:13:58.191;card;Latte;37,72
17/05/2024;2024-05-17 09:00:48.456;card;Americano;27,92
17/05/2024;2024-05-17 11:30:27.553;card;Americano with Milk;32,82
17/05/2024;2024-05-17 14:58:03.060;cash;Americano with Milk;34
17/05/2024;2024-05-17 19:55:18.534;card;Americano with Milk;32,82
17/05/2024;2024-05-17 19:56:46.751;card;Cappuccino;37,72
17/05/2024;2024-05-17 20:37:52.930;card;Cappuccino;37,72
17/05/2024;2024-05-17 22:34:50.797;card;Americano;27,92
17/05/2024;2024-05-17 22:36:33.357;card;Latte;37,72
17/05/2024;2024-05-17 22:37:42.821;card;Latte;37,72
18/05/2024;2024-05-18 08:01:37.898;card;Cappuccino;37,72
18/05/2024;2024-05-18 08:02:39.959;card;Cappuccino;37,72
18/05/2024;2024-05-18 11:15:56.089;card;Americano with Milk;32,82
18/05/2024;2024-05-18 16:48:29.374;card;Americano with Milk;32,82
18/05/2024;2024-05-18 16:49:27.131;card;Americano with Milk;32,82
18/05/2024;2024-05-18 19:58:44.210;card;Americano with Milk;32,82
18/05/2024;2024-05-18 20:22:53.111;card;Latte;37,72
18/05/2024;2024-05-18 22:05:27.473;cash;Cappuccino;39
19/05/2024;2024-05-19 07:58:38.312;card;Americano;27,92
19/05/2024;2024-05-19 07:59:33.549;card;Americano;27,92
19/05/2024;2024-05-19 08:00:35.061;card;Cappuccino;37,72
19/05/2024;2024-05-19 09:28:49.723;cash;Espresso;24
19/05/2024;2024-05-19 12:14:26.676;card;Americano with Milk;32,82
19/05/2024;2024-05-19 14:43:40.049;card;Americano;27,92
19/05/2024;2024-05-19 15:58:58.192;card;Americano with Milk;32,82
19/05/2024;2024-05-19 18:12:36.304;card;Americano with Milk;32,82
19/05/2024;2024-05-19 18:13:47.762;card;Espresso;23,02
19/05/2024;2024-05-19 18:16:30.022;card;Hot Chocolate;37,72
19/05/2024;2024-05-19 19:51:06.979;card;Cappuccino;37,72
19/05/2024;2024-05-19 21:15:41.761;card;Cappuccino;37,72
19/05/2024;2024-05-19 21:18:36.101;card;Cappuccino;37,72
20/05/2024;2024-05-20 10:05:59.163;card;Americano with Milk;32,82
20/05/2024;2024-05-20 10:17:51.867;card;Latte;37,72
20/05/2024;2024-05-20 10:58:48.379;card;Latte;37,72
20/05/2024;2024-05-20 11:15:16.363;card;Americano;27,92
20/05/2024;2024-05-20 11:16:19.637;card;Americano;27,92
20/05/2024;2024-05-20 13:27:13.420;card;Americano;27,92
20/05/2024;2024-05-20 13:28:10.440;card;Americano;27,92
20/05/2024;2024-05-20 14:13:19.017;card;Americano with Milk;32,82
20/05/2024;2024-05-20 14:14:31.354;card;Cappuccino;37,72
20/05/2024;2024-05-20 14:32:21.252;cash;Americano;29
20/05/2024;2024-05-20 17:12:51.121;card;Latte;37,72
20/05/2024;2024-05-20 17:13:56.897;card;Latte;37,72
20/05/2024;2024-05-20 20:36:48.320;card;Americano with Milk;32,82
20/05/2024;2024-05-20 20:37:57.316;card;Cocoa;37,72
20/05/2024;2024-05-20 20:46:52.085;card;Cortado;27,92
20/05/2024;2024-05-20 21:36:53.986;card;Americano with Milk;32,82
20/05/2024;2024-05-20 21:37:57.777;card;Americano with Milk;32,82
21/05/2024;2024-05-21 08:27:38.230;card;Latte;37,72
21/05/2024;2024-05-21 09:43:50.690;cash;Americano;29
21/05/2024;2024-05-21 09:44:40.309;cash;Americano with Milk;34
21/05/2024;2024-05-21 09:46:09.430;cash;Cocoa;39
21/05/2024;2024-05-21 10:05:08.033;cash;Latte;39
21/05/2024;2024-05-21 16:10:19.956;card;Latte;37,72
21/05/2024;2024-05-21 18:13:23.998;card;Espresso;23,02
21/05/2024;2024-05-21 19:11:09.212;card;Cappuccino;37,72
21/05/2024;2024-05-21 20:13:48.358;card;Cappuccino;37,72
22/05/2024;2024-05-22 09:34:41.818;card;Cappuccino;37,72
22/05/2024;2024-05-22 10:49:47.044;card;Americano with Milk;32,82
22/05/2024;2024-05-22 11:18:14.265;card;Cortado;27,92
22/05/2024;2024-05-22 11:34:54.968;card;Americano with Milk;32,82
22/05/2024;2024-05-22 12:29:50.841;card;Americano;27,92
22/05/2024;2024-05-22 12:30:43.347;card;Americano;27,92
22/05/2024;2024-05-22 14:00:20.499;card;Americano with Milk;32,82
22/05/2024;2024-05-22 19:24:58.098;card;Cappuccino;37,72
22/05/2024;2024-05-22 19:25:58.574;card;Cappuccino;37,72
22/05/2024;2024-05-22 21:23:53.000;card;Hot Chocolate;37,72
22/05/2024;2024-05-22 21:24:49.584;card;Cappuccino;37,72
23/05/2024;2024-05-23 10:10:19.640;card;Cappuccino;37,72
23/05/2024;2024-05-23 12:22:06.605;card;Espresso;23,02
23/05/2024;2024-05-23 15:55:16.628;card;Cappuccino;37,72
23/05/2024;2024-05-23 15:56:27.237;card;Cappuccino;37,72
23/05/2024;2024-05-23 16:18:14.053;card;Cappuccino;37,72
23/05/2024;2024-05-23 16:41:00.043;card;Latte;37,72
23/05/2024;2024-05-23 17:14:33.237;card;Cappuccino;37,72
23/05/2024;2024-05-23 17:15:44.861;card;Latte;37,72
23/05/2024;2024-05-23 19:03:53.856;card;Cortado;27,92
23/05/2024;2024-05-23 19:17:28.431;card;Cappuccino;37,72
23/05/2024;2024-05-23 19:18:26.418;card;Cappuccino;37,72
23/05/2024;2024-05-23 19:42:31.546;card;Cappuccino;37,72
23/05/2024;2024-05-23 20:15:01.429;card;Cappuccino;37,72
23/05/2024;2024-05-23 20:16:24.205;card;Latte;37,72
23/05/2024;2024-05-23 22:48:10.813;card;Americano with Milk;32,82
23/05/2024;2024-05-23 22:55:36.926;cash;Hot Chocolate;39
24/05/2024;2024-05-24 11:11:59.182;card;Cortado;27,92
24/05/2024;2024-05-24 11:15:08.341;card;Americano;27,92
24/05/2024;2024-05-24 11:16:13.016;card;Americano;27,92
24/05/2024;2024-05-24 16:07:19.816;card;Hot Chocolate;37,72
24/05/2024;2024-05-24 18:17:40.330;card;Cortado;27,92
24/05/2024;2024-05-24 18:18:36.698;card;Cortado;27,92
24/05/2024;2024-05-24 22:30:40.198;card;Americano with Milk;32,82
25/05/2024;2024-05-25 07:40:58.818;cash;Americano;29
25/05/2024;2024-05-25 12:13:53.388;card;Latte;37,72
25/05/2024;2024-05-25 12:40:23.587;cash;Americano;29
25/05/2024;2024-05-25 12:42:10.258;card;Americano with Milk;32,82
25/05/2024;2024-05-25 12:43:13.275;card;Americano with Milk;32,82
25/05/2024;2024-05-25 12:58:12.049;card;Americano with Milk;32,82
25/05/2024;2024-05-25 16:47:09.557;card;Americano with Milk;32,82
25/05/2024;2024-05-25 16:48:16.834;card;Americano;27,92
26/05/2024;2024-05-26 10:20:02.233;card;Latte;37,72
26/05/2024;2024-05-26 14:24:49.812;card;Americano with Milk;32,82
26/05/2024;2024-05-26 14:26:05.248;card;Cortado;27,92
26/05/2024;2024-05-26 14:40:58.882;card;Americano with Milk;32,82
26/05/2024;2024-05-26 17:19:15.521;card;Cappuccino;37,72
26/05/2024;2024-05-26 18:09:52.843;card;Hot Chocolate;37,72
26/05/2024;2024-05-26 18:11:02.204;card;Hot Chocolate;37,72
26/05/2024;2024-05-26 18:13:14.299;card;Americano;27,92
26/05/2024;2024-05-26 18:39:18.794;card;Latte;37,72
26/05/2024;2024-05-26 20:59:14.954;card;Hot Chocolate;37,72
26/05/2024;2024-05-26 21:00:05.568;card;Cappuccino;37,72
26/05/2024;2024-05-26 21:02:36.935;card;Cortado;27,92
26/05/2024;2024-05-26 21:03:51.772;card;Cappuccino;37,72
26/05/2024;2024-05-26 21:04:58.824;card;Latte;37,72
26/05/2024;2024-05-26 21:06:02.621;card;Cappuccino;37,72
27/05/2024;2024-05-27 11:34:55.252;card;Americano;27,92
27/05/2024;2024-05-27 14:05:21.688;card;Americano with Milk;32,82
27/05/2024;2024-05-27 14:06:43.564;card;Cocoa;37,72
27/05/2024;2024-05-27 15:11:34.061;card;Americano;27,92
27/05/2024;2024-05-27 15:14:05.788;card;Americano;27,92
27/05/2024;2024-05-27 17:50:55.763;card;Latte;37,72
27/05/2024;2024-05-27 18:00:50.983;card;Americano;27,92
27/05/2024;2024-05-27 19:16:27.404;card;Latte;37,72
27/05/2024;2024-05-27 19:17:38.729;card;Latte;37,72
27/05/2024;2024-05-27 21:29:07.085;card;Americano with Milk;32,82
27/05/2024;2024-05-27 21:30:19.772;card;Cappuccino;37,72
28/05/2024;2024-05-28 08:37:09.028;card;Americano with Milk;32,82
28/05/2024;2024-05-28 09:20:10.736;card;Americano with Milk;32,82
28/05/2024;2024-05-28 11:48:18.494;card;Cappuccino;37,72
28/05/2024;2024-05-28 13:14:40.435;card;Cappuccino;37,72
28/05/2024;2024-05-28 14:10:53.691;card;Cocoa;37,72
28/05/2024;2024-05-28 16:25:39.330;card;Cortado;27,92
28/05/2024;2024-05-28 17:21:43.967;cash;Cappuccino;39
28/05/2024;2024-05-28 19:09:29.069;card;Americano;27,92
28/05/2024;2024-05-28 19:10:31.070;card;Latte;37,72
28/05/2024;2024-05-28 20:24:32.205;card;Americano with Milk;32,82
28/05/2024;2024-05-28 20:50:19.449;card;Americano;27,92
29/05/2024;2024-05-29 09:14:43.704;card;Latte;37,72
29/05/2024;2024-05-29 10:48:46.781;cash;Latte;39
29/05/2024;2024-05-29 11:14:02.855;card;Hot Chocolate;37,72
29/05/2024;2024-05-29 15:10:48.545;card;Americano;27,92
29/05/2024;2024-05-29 15:22:56.321;card;Latte;37,72
29/05/2024;2024-05-29 15:45:12.738;card;Cappuccino;37,72
29/05/2024;2024-05-29 16:45:03.950;card;Latte;37,72
29/05/2024;2024-05-29 18:24:03.334;card;Cortado;27,92
29/05/2024;2024-05-29 18:24:59.311;card;Latte;37,72
29/05/2024;2024-05-29 20:30:42.240;card;Hot Chocolate;37,72
29/05/2024;2024-05-29 20:32:35.200;card;Cocoa;37,72
30/05/2024;2024-05-30 08:29:06.277;card;Cappuccino;37,72
30/05/2024;2024-05-30 08:30:21.586;card;Latte;37,72
30/05/2024;2024-05-30 08:37:05.382;card;Americano with Milk;32,82
30/05/2024;2024-05-30 09:47:59.092;card;Latte;37,72
30/05/2024;2024-05-30 14:56:15.473;card;Americano with Milk;32,82
30/05/2024;2024-05-30 15:16:15.665;card;Espresso;23,02
30/05/2024;2024-05-30 15:17:38.656;card;Espresso;23,02
30/05/2024;2024-05-30 19:53:11.189;card;Cappuccino;37,72
30/05/2024;2024-05-30 20:31:05.430;card;Latte;37,72
30/05/2024;2024-05-30 20:46:13.835;card;Hot Chocolate;37,72
30/05/2024;2024-05-30 20:47:21.586;card;Americano with Milk;32,82
31/05/2024;2024-05-31 07:53:57.274;card;Americano with Milk;32,82
31/05/2024;2024-05-31 09:21:07.821;card;Latte;37,72
31/05/2024;2024-05-31 09:23:58.791;cash;Latte;39
31/05/2024;2024-05-31 10:38:07.861;card;Hot Chocolate;37,72
31/05/2024;2024-05-31 10:39:06.136;card;Cocoa;37,72
31/05/2024;2024-05-31 14:50:12.976;card;Americano with Milk;32,82
31/05/2024;2024-05-31 18:23:44.636;card;Latte;37,72
31/05/2024;2024-05-31 18:25:03.271;card;Latte;37,72
31/05/2024;2024-05-31 20:06:39.166;card;Cappuccino;37,72
31/05/2024;2024-05-31 20:33:06.403;card;Americano with Milk;32,82
31/05/2024;2024-05-31 20:34:32.903;card;Latte;37,72
31/05/2024;2024-05-31 22:05:47.070;card;Cappuccino;37,72
31/05/2024;2024-05-31 22:06:52.490;card;Americano with Milk;32,82
31/05/2024;2024-05-31 22:07:55.368;card;Cortado;27,92
1/06/2024;2024-06-01 08:27:01.745;card;Cortado;27,92
1/06/2024;2024-06-01 09:48:24.750;card;Latte;37,72
1/06/2024;2024-06-01 11:38:09.371;card;Latte;37,72
1/06/2024;2024-06-01 14:28:53.739;card;Americano with Milk;32,82
1/06/2024;2024-06-01 18:20:12.780;card;Americano with Milk;32,82
1/06/2024;2024-06-01 18:21:15.363;card;Americano with Milk;32,82
1/06/2024;2024-06-01 20:50:10.488;card;Cappuccino;37,72
1/06/2024;2024-06-01 20:51:13.565;card;Cappuccino;37,72
1/06/2024;2024-06-01 20:54:59.267;cash;Cocoa;39
1/06/2024;2024-06-01 20:59:09.689;card;Cocoa;37,72
1/06/2024;2024-06-01 21:51:04.971;card;Americano with Milk;32,82
2/06/2024;2024-06-02 20:03:25.799;card;Latte;37,72
2/06/2024;2024-06-02 20:24:02.449;card;Americano with Milk;32,82
2/06/2024;2024-06-02 20:25:07.238;card;Cappuccino;37,72
2/06/2024;2024-06-02 21:07:20.531;card;Americano with Milk;32,82
2/06/2024;2024-06-02 21:30:12.430;card;Latte;37,72
2/06/2024;2024-06-02 22:43:10.636;cash;Americano with Milk;34
3/06/2024;2024-06-03 10:12:04.141;card;Latte;37,72
3/06/2024;2024-06-03 10:27:49.797;card;Latte;37,72
3/06/2024;2024-06-03 14:31:42.338;card;Cappuccino;37,72
3/06/2024;2024-06-03 14:33:00.952;card;Americano with Milk;32,82
3/06/2024;2024-06-03 14:34:06.922;card;Latte;37,72
3/06/2024;2024-06-03 21:42:51.734;cash;Americano with Milk;34
3/06/2024;2024-06-03 21:43:37.471;cash;Americano with Milk;34
4/06/2024;2024-06-04 09:23:42.898;card;Cortado;27,92
4/06/2024;2024-06-04 10:27:13.975;card;Americano with Milk;32,82
4/06/2024;2024-06-04 12:02:10.213;card;Latte;37,72
4/06/2024;2024-06-04 12:05:29.186;card;Hot Chocolate;37,72
4/06/2024;2024-06-04 15:30:32.455;card;Latte;37,72
4/06/2024;2024-06-04 17:46:36.661;card;Cortado;27,92
4/06/2024;2024-06-04 17:47:28.847;card;Cappuccino;37,72
4/06/2024;2024-06-04 20:13:01.204;card;Hot Chocolate;37,72
4/06/2024;2024-06-04 20:50:33.896;card;Cappuccino;37,72
4/06/2024;2024-06-04 21:31:58.908;card;Cortado;27,92
4/06/2024;2024-06-04 21:33:02.621;card;Americano with Milk;32,82
4/06/2024;2024-06-04 21:34:55.667;card;Americano with Milk;32,82
4/06/2024;2024-06-04 21:36:06.924;card;Americano with Milk;32,82
4/06/2024;2024-06-04 21:37:15.164;card;Americano with Milk;32,82
5/06/2024;2024-06-05 08:21:48.964;card;Cappuccino;37,72
5/06/2024;2024-06-05 08:23:06.723;card;Cappuccino;37,72
5/06/2024;2024-06-05 09:22:43.108;card;Americano;27,92
5/06/2024;2024-06-05 10:28:50.620;card;Latte;37,72
5/06/2024;2024-06-05 10:40:53.188;card;Americano with Milk;32,82
5/06/2024;2024-06-05 19:43:57.675;card;Americano with Milk;32,82
5/06/2024;2024-06-05 19:59:53.527;card;Latte;37,72
5/06/2024;2024-06-05 20:10:47.623;card;Cocoa;37,72
5/06/2024;2024-06-05 20:12:01.658;card;Cortado;27,92
6/06/2024;2024-06-06 08:52:56.351;card;Americano with Milk;32,82
6/06/2024;2024-06-06 08:54:08.455;card;Americano with Milk;32,82
6/06/2024;2024-06-06 10:36:09.667;card;Latte;37,72
6/06/2024;2024-06-06 12:17:41.474;card;Americano;27,92
6/06/2024;2024-06-06 15:11:14.185;card;Americano with Milk;32,82
6/06/2024;2024-06-06 15:24:06.221;card;Cappuccino;37,72
6/06/2024;2024-06-06 21:14:05.102;card;Latte;37,72
6/06/2024;2024-06-06 21:15:42.227;card;Latte;37,72
6/06/2024;2024-06-06 21:18:26.713;card;Cappuccino;37,72
6/06/2024;2024-06-06 21:19:30.436;card;Americano with Milk;32,82
6/06/2024;2024-06-06 21:21:04.440;card;Latte;37,72
7/06/2024;2024-06-07 08:18:04.296;card;Cappuccino;37,72
7/06/2024;2024-06-07 10:35:28.104;card;Espresso;23,02
7/06/2024;2024-06-07 13:34:18.297;card;Americano with Milk;32,82
7/06/2024;2024-06-07 16:45:42.218;card;Cortado;27,92
7/06/2024;2024-06-07 16:47:15.481;card;Cortado;27,92
8/06/2024;2024-06-08 09:04:20.016;card;Cortado;27,92
8/06/2024;2024-06-08 09:26:11.160;card;Americano with Milk;32,82
8/06/2024;2024-06-08 20:24:54.320;card;Cappuccino;37,72
8/06/2024;2024-06-08 20:25:56.316;card;Cappuccino;37,72
9/06/2024;2024-06-09 08:15:52.760;card;Latte;37,72
9/06/2024;2024-06-09 10:30:04.461;card;Latte;37,72
9/06/2024;2024-06-09 10:52:05.797;card;Cappuccino;37,72
9/06/2024;2024-06-09 11:04:41.306;card;Cortado;27,92
9/06/2024;2024-06-09 11:07:08.108;card;Espresso;23,02
9/06/2024;2024-06-09 11:52:49.616;card;Cappuccino;37,72
9/06/2024;2024-06-09 12:11:23.640;card;Americano with Milk;32,82
9/06/2024;2024-06-09 12:13:08.067;card;Latte;37,72
9/06/2024;2024-06-09 12:14:10.783;card;Latte;37,72
9/06/2024;2024-06-09 15:10:30.692;card;Cortado;27,92
9/06/2024;2024-06-09 16:17:28.189;card;Cappuccino;37,72
9/06/2024;2024-06-09 19:21:19.277;card;Americano with Milk;32,82
9/06/2024;2024-06-09 21:05:08.844;card;Americano;27,92
10/06/2024;2024-06-10 12:47:49.861;card;Cappuccino;37,72
10/06/2024;2024-06-10 12:56:48.268;card;Latte;37,72
10/06/2024;2024-06-10 19:04:28.106;card;Hot Chocolate;37,72
10/06/2024;2024-06-10 19:05:22.770;card;Hot Chocolate;37,72
10/06/2024;2024-06-10 19:37:23.602;card;Latte;37,72
10/06/2024;2024-06-10 19:38:19.678;card;Latte;37,72
11/06/2024;2024-06-11 10:38:03.953;card;Americano with Milk;32,82
11/06/2024;2024-06-11 18:48:25.292;card;Latte;37,72
11/06/2024;2024-06-11 18:49:36.428;card;Latte;37,72
11/06/2024;2024-06-11 21:17:03.344;card;Hot Chocolate;37,72
11/06/2024;2024-06-11 21:27:41.900;card;Americano with Milk;32,82
11/06/2024;2024-06-11 21:28:50.220;card;Americano with Milk;32,82
12/06/2024;2024-06-12 10:18:18.786;card;Hot Chocolate;37,72
12/06/2024;2024-06-12 11:51:43.858;card;Cappuccino;37,72
12/06/2024;2024-06-12 17:41:17.179;card;Latte;37,72
12/06/2024;2024-06-12 17:47:27.878;card;Latte;37,72
12/06/2024;2024-06-12 20:16:33.648;card;Hot Chocolate;37,72
12/06/2024;2024-06-12 20:25:34.239;card;Americano with Milk;32,82
13/06/2024;2024-06-13 08:54:24.207;card;Americano;27,92
13/06/2024;2024-06-13 08:57:25.592;card;Latte;37,72
13/06/2024;2024-06-13 09:50:25.038;card;Americano with Milk;32,82
13/06/2024;2024-06-13 09:57:11.518;card;Cortado;27,92
13/06/2024;2024-06-13 17:04:58.601;card;Americano with Milk;32,82
13/06/2024;2024-06-13 17:27:46.626;card;Hot Chocolate;37,72
13/06/2024;2024-06-13 19:22:19.083;card;Latte;37,72
13/06/2024;2024-06-13 20:20:51.762;card;Americano with Milk;32,82
13/06/2024;2024-06-13 20:43:45.991;card;Espresso;23,02
13/06/2024;2024-06-13 20:45:00.615;card;Espresso;23,02
13/06/2024;2024-06-13 20:48:17.902;card;Americano with Milk;32,82
13/06/2024;2024-06-13 21:02:28.377;card;Americano with Milk;32,82
14/06/2024;2024-06-14 07:46:13.238;card;Cortado;27,92
14/06/2024;2024-06-14 10:30:31.584;card;Americano;27,92
14/06/2024;2024-06-14 12:14:41.696;card;Latte;37,72
14/06/2024;2024-06-14 18:29:53.399;card;Americano with Milk;32,82
15/06/2024;2024-06-15 11:26:01.974;card;Cappuccino;37,72
15/06/2024;2024-06-15 12:21:28.135;card;Latte;37,72
15/06/2024;2024-06-15 12:22:46.942;card;Americano with Milk;32,82
15/06/2024;2024-06-15 12:23:52.166;card;Espresso;23,02
15/06/2024;2024-06-15 12:24:35.130;card;Cocoa;37,72
15/06/2024;2024-06-15 12:25:23.960;card;Americano with Milk;32,82
15/06/2024;2024-06-15 16:03:29.909;card;Americano with Milk;32,82
15/06/2024;2024-06-15 18:14:04.623;card;Americano;27,92
16/06/2024;2024-06-16 10:43:51.456;card;Americano with Milk;32,82
16/06/2024;2024-06-16 10:58:41.366;card;Latte;37,72
16/06/2024;2024-06-16 11:00:38.191;card;Hot Chocolate;37,72
16/06/2024;2024-06-16 11:01:41.488;card;Hot Chocolate;37,72
16/06/2024;2024-06-16 12:49:27.624;card;Americano with Milk;32,82
16/06/2024;2024-06-16 14:00:38.992;card;Espresso;23,02
16/06/2024;2024-06-16 15:02:36.332;card;Americano with Milk;32,82
16/06/2024;2024-06-16 15:05:10.421;card;Americano with Milk;32,82
16/06/2024;2024-06-16 15:43:59.593;card;Hot Chocolate;37,72
16/06/2024;2024-06-16 16:47:36.521;card;Hot Chocolate;37,72
16/06/2024;2024-06-16 17:45:17.267;card;Americano with Milk;32,82
16/06/2024;2024-06-16 17:46:16.554;card;Americano with Milk;32,82
17/06/2024;2024-06-17 08:57:24.044;card;Americano;27,92
17/06/2024;2024-06-17 10:12:05.139;card;Cortado;27,92
17/06/2024;2024-06-17 10:13:37.575;card;Cortado;27,92
17/06/2024;2024-06-17 10:55:51.608;card;Cappuccino;37,72
17/06/2024;2024-06-17 14:51:35.381;card;Cappuccino;37,72
17/06/2024;2024-06-17 16:50:13.441;card;Cappuccino;37,72
17/06/2024;2024-06-17 16:51:11.038;card;Cappuccino;37,72
17/06/2024;2024-06-17 16:52:36.336;card;Americano;27,92
17/06/2024;2024-06-17 18:51:19.631;card;Americano;27,92
17/06/2024;2024-06-17 21:16:11.485;card;Americano with Milk;32,82
18/06/2024;2024-06-18 14:04:06.125;card;Americano;27,92
18/06/2024;2024-06-18 14:05:12.313;card;Cappuccino;37,72
18/06/2024;2024-06-18 19:20:40.571;card;Cappuccino;37,72
18/06/2024;2024-06-18 19:21:38.892;card;Cappuccino;37,72
18/06/2024;2024-06-18 20:35:49.497;card;Cortado;27,92
18/06/2024;2024-06-18 21:20:49.526;card;Americano with Milk;32,82
18/06/2024;2024-06-18 21:22:18.518;card;Americano with Milk;32,82
19/06/2024;2024-06-19 07:47:19.833;card;Latte;37,72
19/06/2024;2024-06-19 08:17:54.508;card;Cortado;27,92
19/06/2024;2024-06-19 10:54:00.492;card;Americano;27,92
19/06/2024;2024-06-19 11:11:27.807;card;Latte;37,72
19/06/2024;2024-06-19 11:12:31.412;card;Cocoa;37,72
19/06/2024;2024-06-19 14:21:36.258;card;Americano with Milk;32,82
19/06/2024;2024-06-19 18:28:43.437;card;Cappuccino;37,72
19/06/2024;2024-06-19 18:29:58.961;card;Latte;37,72
19/06/2024;2024-06-19 19:31:31.293;card;Americano with Milk;32,82
19/06/2024;2024-06-19 21:28:59.485;card;Cappuccino;37,72
19/06/2024;2024-06-19 21:30:03.484;card;Americano with Milk;32,82
20/06/2024;2024-06-20 10:50:06.453;card;Latte;37,72
20/06/2024;2024-06-20 18:59:02.082;card;Latte;37,72
20/06/2024;2024-06-20 19:00:00.237;card;Latte;37,72
20/06/2024;2024-06-20 21:39:10.013;card;Latte;37,72
20/06/2024;2024-06-20 21:57:40.554;card;Latte;37,72
20/06/2024;2024-06-20 21:59:17.598;card;Americano with Milk;32,82
21/06/2024;2024-06-21 09:59:55.930;card;Latte;37,72
21/06/2024;2024-06-21 10:01:40.183;card;Americano;27,92
21/06/2024;2024-06-21 13:19:19.416;card;Americano with Milk;32,82
21/06/2024;2024-06-21 13:20:31.513;card;Americano with Milk;32,82
21/06/2024;2024-06-21 18:12:16.064;card;Espresso;23,02
21/06/2024;2024-06-21 19:30:26.651;card;Latte;37,72
21/06/2024;2024-06-21 19:47:06.201;card;Cappuccino;37,72
21/06/2024;2024-06-21 19:48:06.713;card;Cappuccino;37,72
21/06/2024;2024-06-21 19:49:54.505;card;Cappuccino;37,72
21/06/2024;2024-06-21 19:51:00.211;card;Cappuccino;37,72
21/06/2024;2024-06-21 19:52:18.775;card;Americano;27,92
21/06/2024;2024-06-21 19:55:37.142;card;Americano with Milk;32,82
22/06/2024;2024-06-22 08:39:50.273;card;Cortado;27,92
22/06/2024;2024-06-22 09:37:48.779;card;Americano with Milk;32,82
22/06/2024;2024-06-22 12:53:15.541;card;Americano with Milk;32,82
22/06/2024;2024-06-22 15:37:20.137;card;Latte;37,72
22/06/2024;2024-06-22 22:10:22.998;card;Cappuccino;37,72
23/06/2024;2024-06-23 18:12:01.406;card;Americano with Milk;32,82
23/06/2024;2024-06-23 18:13:50.638;card;Americano with Milk;32,82
23/06/2024;2024-06-23 21:06:46.956;card;Cappuccino;37,72
23/06/2024;2024-06-23 21:29:07.823;card;Latte;37,72
23/06/2024;2024-06-23 21:30:36.375;card;Cappuccino;37,72
24/06/2024;2024-06-24 11:44:39.939;card;Americano with Milk;32,82
24/06/2024;2024-06-24 11:49:36.044;card;Cappuccino;37,72
24/06/2024;2024-06-24 11:50:44.080;card;Cappuccino;37,72
24/06/2024;2024-06-24 15:02:28.995;card;Latte;37,72
24/06/2024;2024-06-24 16:46:00.573;card;Cappuccino;37,72
24/06/2024;2024-06-24 16:47:00.409;card;Cappuccino;37,72
25/06/2024;2024-06-25 08:19:24.244;card;Latte;37,72
25/06/2024;2024-06-25 10:28:26.408;card;Americano with Milk;32,82
25/06/2024;2024-06-25 10:29:42.410;card;Americano with Milk;32,82
25/06/2024;2024-06-25 11:34:52.296;card;Cappuccino;37,72
26/06/2024;2024-06-26 09:33:01.706;card;Latte;37,72
26/06/2024;2024-06-26 16:32:29.453;card;Espresso;23,02
26/06/2024;2024-06-26 16:34:01.607;card;Americano;27,92
26/06/2024;2024-06-26 21:21:53.296;card;Latte;37,72
26/06/2024;2024-06-26 21:27:00.807;card;Cappuccino;37,72
26/06/2024;2024-06-26 21:28:14.566;card;Americano with Milk;32,82
27/06/2024;2024-06-27 09:15:43.173;card;Americano with Milk;32,82
27/06/2024;2024-06-27 16:11:48.000;card;Cortado;27,92
27/06/2024;2024-06-27 21:44:03.372;card;Americano with Milk;32,82
27/06/2024;2024-06-27 21:50:31.617;card;Cappuccino;37,72
28/06/2024;2024-06-28 08:08:35.044;card;Cortado;27,92
28/06/2024;2024-06-28 17:51:53.993;card;Espresso;23,02
28/06/2024;2024-06-28 21:50:55.375;card;Americano with Milk;32,82
28/06/2024;2024-06-28 21:52:01.867;card;Latte;37,72
28/06/2024;2024-06-28 22:28:19.976;card;Cappuccino;37,72
29/06/2024;2024-06-29 09:47:10.304;card;Americano with Milk;32,82
29/06/2024;2024-06-29 11:40:19.582;card;Americano with Milk;32,82
29/06/2024;2024-06-29 11:41:26.609;card;Americano with Milk;32,82
29/06/2024;2024-06-29 12:30:24.358;card;Cappuccino;37,72
29/06/2024;2024-06-29 12:31:42.582;card;Cappuccino;37,72
29/06/2024;2024-06-29 17:23:43.583;card;Cappuccino;37,72
29/06/2024;2024-06-29 17:24:52.377;card;Hot Chocolate;37,72
29/06/2024;2024-06-29 21:27:22.449;card;Latte;37,72
30/06/2024;2024-06-30 10:28:09.842;card;Latte;37,72
30/06/2024;2024-06-30 13:05:50.620;card;Espresso;23,02
30/06/2024;2024-06-30 16:54:41.679;card;Hot Chocolate;37,72
30/06/2024;2024-06-30 21:04:09.746;card;Americano with Milk;32,82
1/07/2024;2024-07-01 18:07:26.760;card;Espresso;23,02
1/07/2024;2024-07-01 18:56:51.844;card;Cappuccino;37,72
1/07/2024;2024-07-01 18:57:54.267;card;Cappuccino;37,72
2/07/2024;2024-07-02 10:42:54.057;card;Americano with Milk;32,82
2/07/2024;2024-07-02 10:45:00.617;card;Americano;27,92
2/07/2024;2024-07-02 12:48:05.181;card;Latte;37,72
2/07/2024;2024-07-02 14:03:13.231;card;Americano;27,92
2/07/2024;2024-07-02 16:31:24.337;card;Americano with Milk;32,82
2/07/2024;2024-07-02 22:02:23.576;card;Americano with Milk;32,82
3/07/2024;2024-07-03 13:51:14.935;card;Americano with Milk;32,82
3/07/2024;2024-07-03 16:01:16.554;card;Cappuccino;37,72
3/07/2024;2024-07-03 16:50:25.223;card;Cappuccino;37,72
3/07/2024;2024-07-03 16:53:15.618;card;Americano with Milk;32,82
3/07/2024;2024-07-03 16:54:22.907;card;Americano with Milk;32,82
3/07/2024;2024-07-03 16:55:31.423;card;Latte;37,72
3/07/2024;2024-07-03 16:59:25.580;card;Espresso;23,02
3/07/2024;2024-07-03 17:59:01.827;card;Cappuccino;37,72
3/07/2024;2024-07-03 19:06:09.136;card;Latte;37,72
4/07/2024;2024-07-04 10:26:23.725;card;Americano with Milk;32,82
4/07/2024;2024-07-04 10:27:30.261;card;Americano;27,92
5/07/2024;2024-07-05 12:20:28.670;card;Cocoa;37,72
5/07/2024;2024-07-05 13:43:43.134;card;Americano with Milk;32,82
5/07/2024;2024-07-05 13:44:43.829;card;Americano with Milk;32,82
5/07/2024;2024-07-05 18:55:56.308;card;Espresso;23,02
5/07/2024;2024-07-05 19:55:07.812;card;Americano;27,92
5/07/2024;2024-07-05 22:11:56.471;card;Espresso;23,02
5/07/2024;2024-07-05 22:18:03.324;card;Americano;27,92
5/07/2024;2024-07-05 22:18:56.945;card;Americano;27,92
5/07/2024;2024-07-05 22:20:01.149;card;Cappuccino;37,72
5/07/2024;2024-07-05 22:21:09.457;card;Americano with Milk;32,82
6/07/2024;2024-07-06 10:28:06.826;card;Latte;37,72
6/07/2024;2024-07-06 17:15:46.042;card;Latte;32,82
6/07/2024;2024-07-06 17:17:01.046;card;Latte;32,82
6/07/2024;2024-07-06 19:09:46.107;card;Latte;32,82
6/07/2024;2024-07-06 19:10:39.580;card;Americano with Milk;27,92
7/07/2024;2024-07-07 09:04:20.169;card;Cappuccino;32,82
7/07/2024;2024-07-07 09:14:29.225;card;Americano with Milk;27,92
7/07/2024;2024-07-07 09:15:36.815;card;Americano with Milk;27,92
7/07/2024;2024-07-07 09:28:48.876;card;Cappuccino;32,82
7/07/2024;2024-07-07 09:29:56.189;card;Cappuccino;32,82
7/07/2024;2024-07-07 14:56:30.193;card;Hot Chocolate;32,82
7/07/2024;2024-07-07 14:57:47.411;card;Cocoa;32,82
7/07/2024;2024-07-07 17:07:50.284;card;Latte;32,82
7/07/2024;2024-07-07 19:33:27.187;card;Cappuccino;32,82
7/07/2024;2024-07-07 20:01:31.653;card;Hot Chocolate;32,82
7/07/2024;2024-07-07 22:33:36.255;card;Americano with Milk;27,92
8/07/2024;2024-07-08 07:33:07.724;card;Latte;32,82
8/07/2024;2024-07-08 12:02:50.421;card;Americano;23,02
8/07/2024;2024-07-08 14:40:24.350;card;Americano;23,02
8/07/2024;2024-07-08 19:30:34.976;card;Americano with Milk;27,92
8/07/2024;2024-07-08 22:14:46.180;card;Latte;32,82
9/07/2024;2024-07-09 10:26:52.138;card;Americano with Milk;27,92
9/07/2024;2024-07-09 10:40:28.767;card;Americano with Milk;27,92
9/07/2024;2024-07-09 11:21:36.103;card;Americano with Milk;27,92
9/07/2024;2024-07-09 11:22:49.904;card;Cappuccino;32,82
9/07/2024;2024-07-09 16:42:59.535;card;Americano with Milk;27,92
10/07/2024;2024-07-10 11:10:41.690;card;Americano;23,02
10/07/2024;2024-07-10 12:28:53.659;card;Americano with Milk;27,92
10/07/2024;2024-07-10 22:13:10.049;card;Latte;32,82
11/07/2024;2024-07-11 11:27:27.562;card;Hot Chocolate;32,82
11/07/2024;2024-07-11 16:48:18.709;card;Americano with Milk;27,92
11/07/2024;2024-07-11 22:22:13.648;card;Latte;32,82
11/07/2024;2024-07-11 22:30:58.541;card;Americano;23,02
12/07/2024;2024-07-12 08:03:17.492;card;Cortado;23,02
12/07/2024;2024-07-12 11:48:33.381;card;Hot Chocolate;32,82
12/07/2024;2024-07-12 22:33:25.589;card;Hot Chocolate;32,82
12/07/2024;2024-07-12 22:34:14.307;card;Hot Chocolate;32,82
12/07/2024;2024-07-12 22:35:29.518;card;Hot Chocolate;32,82
13/07/2024;2024-07-13 10:38:10.273;card;Latte;32,82
13/07/2024;2024-07-13 11:41:38.089;card;Latte;32,82
14/07/2024;2024-07-14 10:54:24.307;card;Americano;23,02
14/07/2024;2024-07-14 10:55:30.525;card;Americano with Milk;27,92
14/07/2024;2024-07-14 10:56:30.251;card;Cappuccino;32,82
14/07/2024;2024-07-14 10:57:54.062;card;Latte;32,82
14/07/2024;2024-07-14 11:02:11.798;card;Americano;23,02
14/07/2024;2024-07-14 22:31:29.976;card;Latte;32,82
15/07/2024;2024-07-15 07:33:05.557;card;Cappuccino;32,82
16/07/2024;2024-07-16 12:23:37.467;card;Americano with Milk;27,92
16/07/2024;2024-07-16 19:29:25.485;card;Hot Chocolate;32,82
17/07/2024;2024-07-17 13:04:59.744;card;Americano with Milk;27,92
18/07/2024;2024-07-18 11:10:13.393;card;Americano with Milk;27,92
18/07/2024;2024-07-18 11:11:23.434;card;Espresso;18,12
18/07/2024;2024-07-18 11:32:59.624;card;Americano;23,02
18/07/2024;2024-07-18 11:34:48.437;card;Americano;23,02
18/07/2024;2024-07-18 11:35:51.505;card;Cortado;23,02
18/07/2024;2024-07-18 13:23:33.812;card;Latte;32,82
18/07/2024;2024-07-18 18:18:23.378;card;Cappuccino;32,82
18/07/2024;2024-07-18 19:30:50.562;card;Latte;32,82
18/07/2024;2024-07-18 21:19:41.814;card;Hot Chocolate;32,82
18/07/2024;2024-07-18 21:21:59.855;card;Latte;32,82
18/07/2024;2024-07-18 21:46:18.674;card;Latte;32,82
19/07/2024;2024-07-19 11:03:02.341;card;Americano;23,02
19/07/2024;2024-07-19 11:16:20.509;card;Americano with Milk;27,92
19/07/2024;2024-07-19 12:58:37.561;card;Latte;32,82
19/07/2024;2024-07-19 12:59:55.383;card;Americano with Milk;27,92
19/07/2024;2024-07-19 14:09:20.716;card;Latte;32,82
19/07/2024;2024-07-19 14:11:22.105;card;Cocoa;32,82
19/07/2024;2024-07-19 16:36:19.272;card;Latte;32,82
19/07/2024;2024-07-19 16:37:35.808;card;Latte;32,82
20/07/2024;2024-07-20 08:05:44.469;card;Americano;23,02
20/07/2024;2024-07-20 08:06:48.685;card;Latte;32,82
20/07/2024;2024-07-20 08:07:51.433;card;Americano;23,02
20/07/2024;2024-07-20 09:00:53.605;card;Latte;32,82
20/07/2024;2024-07-20 09:02:27.848;card;Latte;32,82
20/07/2024;2024-07-20 10:39:21.044;card;Americano;23,02
20/07/2024;2024-07-20 15:15:09.221;card;Latte;32,82
21/07/2024;2024-07-21 10:30:55.818;card;Cocoa;32,82
21/07/2024;2024-07-21 11:39:28.776;card;Cappuccino;32,82
21/07/2024;2024-07-21 13:34:30.849;card;Cortado;23,02
21/07/2024;2024-07-21 13:42:31.444;card;Latte;32,82
22/07/2024;2024-07-22 08:13:23.147;card;Americano;23,02
22/07/2024;2024-07-22 08:40:49.554;card;Americano;23,02
22/07/2024;2024-07-22 10:15:37.266;card;Americano with Milk;27,92
22/07/2024;2024-07-22 16:44:37.593;card;Latte;32,82
23/07/2024;2024-07-23 08:12:56.229;card;Latte;32,82
23/07/2024;2024-07-23 08:40:18.981;card;Americano;23,02
23/07/2024;2024-07-23 08:44:53.816;card;Americano with Milk;27,92
23/07/2024;2024-07-23 08:49:25.107;card;Cocoa;32,82
23/07/2024;2024-07-23 08:51:10.365;card;Latte;32,82
23/07/2024;2024-07-23 09:01:45.707;card;Americano;23,02
23/07/2024;2024-07-23 10:03:36.492;card;Americano with Milk;27,92
23/07/2024;2024-07-23 15:20:04.971;card;Americano with Milk;27,92
23/07/2024;2024-07-23 15:21:01.280;card;Latte;32,82
23/07/2024;2024-07-23 21:01:40.612;card;Latte;32,82
23/07/2024;2024-07-23 21:23:13.501;card;Americano;23,02
23/07/2024;2024-07-23 21:24:22.609;card;Americano;23,02
24/07/2024;2024-07-24 09:16:09.814;card;Americano with Milk;27,92
24/07/2024;2024-07-24 09:38:55.007;card;Americano with Milk;27,92
24/07/2024;2024-07-24 09:54:37.456;card;Espresso;18,12
24/07/2024;2024-07-24 11:43:53.121;card;Cappuccino;32,82
24/07/2024;2024-07-24 13:55:13.821;card;Latte;32,82
24/07/2024;2024-07-24 14:45:49.766;card;Espresso;18,12
24/07/2024;2024-07-24 15:18:30.522;card;Latte;32,82
24/07/2024;2024-07-24 19:15:05.678;card;Cappuccino;32,82
24/07/2024;2024-07-24 19:16:59.779;card;Cappuccino;32,82
24/07/2024;2024-07-24 21:17:36.797;card;Americano with Milk;27,92
24/07/2024;2024-07-24 21:18:41.294;card;Americano;23,02
24/07/2024;2024-07-24 21:25:17.493;card;Americano;23,02
25/07/2024;2024-07-25 07:54:47.935;card;Americano;23,02
25/07/2024;2024-07-25 08:49:18.428;card;Latte;32,82
25/07/2024;2024-07-25 10:29:44.629;card;Americano with Milk;27,92
25/07/2024;2024-07-25 11:26:04.701;card;Americano;23,02
25/07/2024;2024-07-25 15:25:06.512;card;Cappuccino;32,82
25/07/2024;2024-07-25 19:21:00.764;card;Cappuccino;32,82
25/07/2024;2024-07-25 21:06:01.272;card;Cortado;23,02
25/07/2024;2024-07-25 21:06:50.002;card;Espresso;18,12
25/07/2024;2024-07-25 22:38:51.330;card;Cortado;23,02
25/07/2024;2024-07-25 22:39:46.790;card;Cocoa;32,82
26/07/2024;2024-07-26 08:33:01.273;card;Latte;32,82
26/07/2024;2024-07-26 09:19:37.376;card;Americano with Milk;27,92
26/07/2024;2024-07-26 09:20:34.344;card;Espresso;18,12
26/07/2024;2024-07-26 09:33:11.511;card;Cortado;23,02
26/07/2024;2024-07-26 09:34:16.633;card;Cortado;23,02
26/07/2024;2024-07-26 09:59:07.867;card;Latte;32,82
26/07/2024;2024-07-26 10:00:02.719;card;Latte;32,82
26/07/2024;2024-07-26 11:47:13.855;card;Americano with Milk;27,92
26/07/2024;2024-07-26 12:07:01.670;card;Americano with Milk;27,92
26/07/2024;2024-07-26 12:28:08.044;card;Cappuccino;32,82
26/07/2024;2024-07-26 12:29:17.708;card;Cappuccino;32,82
26/07/2024;2024-07-26 13:09:56.138;card;Latte;32,82
26/07/2024;2024-07-26 17:23:29.347;card;Americano;23,02
26/07/2024;2024-07-26 17:58:29.217;card;Cappuccino;32,82
26/07/2024;2024-07-26 21:15:09.612;card;Latte;32,82
26/07/2024;2024-07-26 22:49:52.318;card;Americano with Milk;27,92
27/07/2024;2024-07-27 09:09:16.457;card;Cappuccino;32,82
27/07/2024;2024-07-27 11:55:31.381;card;Americano with Milk;27,92
27/07/2024;2024-07-27 12:25:10.115;card;Americano with Milk;27,92
27/07/2024;2024-07-27 12:26:13.159;card;Espresso;18,12
27/07/2024;2024-07-27 12:33:23.070;card;Americano with Milk;27,92
27/07/2024;2024-07-27 14:28:41.904;card;Espresso;18,12
27/07/2024;2024-07-27 14:51:53.196;card;Latte;32,82
27/07/2024;2024-07-27 17:02:33.358;card;Cappuccino;32,82
27/07/2024;2024-07-27 17:03:39.112;card;Cappuccino;32,82
27/07/2024;2024-07-27 17:09:00.424;card;Americano with Milk;27,92
27/07/2024;2024-07-27 17:10:08.074;card;Americano with Milk;27,92
27/07/2024;2024-07-27 20:55:20.175;card;Latte;32,82
27/07/2024;2024-07-27 22:56:23.915;card;Cappuccino;32,82
28/07/2024;2024-07-28 11:07:25.920;card;Espresso;18,12
28/07/2024;2024-07-28 14:17:54.205;card;Americano with Milk;27,92
28/07/2024;2024-07-28 14:18:52.196;card;Latte;32,82
29/07/2024;2024-07-29 08:12:06.406;card;Latte;32,82
29/07/2024;2024-07-29 09:04:47.972;card;Americano;23,02
29/07/2024;2024-07-29 09:15:46.155;card;Americano with Milk;27,92
29/07/2024;2024-07-29 09:19:44.082;card;Americano;23,02
29/07/2024;2024-07-29 09:51:24.747;card;Americano with Milk;27,92
29/07/2024;2024-07-29 09:58:29.639;card;Cappuccino;32,82
29/07/2024;2024-07-29 10:43:43.961;card;Hot Chocolate;32,82
29/07/2024;2024-07-29 10:44:55.846;card;Hot Chocolate;32,82
29/07/2024;2024-07-29 19:06:31.131;card;Cappuccino;32,82
29/07/2024;2024-07-29 19:30:16.319;card;Americano;23,02
29/07/2024;2024-07-29 21:57:34.419;card;Cocoa;32,82
30/07/2024;2024-07-30 07:41:10.945;card;Americano with Milk;27,92
30/07/2024;2024-07-30 08:05:07.216;card;Cortado;23,02
30/07/2024;2024-07-30 08:20:51.115;card;Cappuccino;32,82
30/07/2024;2024-07-30 09:13:43.217;card;Americano with Milk;27,92
30/07/2024;2024-07-30 10:17:11.147;card;Cortado;23,02
30/07/2024;2024-07-30 10:19:34.213;card;Americano with Milk;27,92
30/07/2024;2024-07-30 10:23:20.120;card;Latte;32,82
30/07/2024;2024-07-30 11:12:07.359;card;Americano;23,02
30/07/2024;2024-07-30 11:13:16.218;card;Espresso;18,12
30/07/2024;2024-07-30 11:14:41.678;card;Americano with Milk;27,92
30/07/2024;2024-07-30 11:16:01.630;card;Americano with Milk;27,92
30/07/2024;2024-07-30 11:30:34.737;card;Americano with Milk;27,92
30/07/2024;2024-07-30 11:31:40.809;card;Americano with Milk;27,92
30/07/2024;2024-07-30 12:08:07.508;card;Latte;32,82
30/07/2024;2024-07-30 15:16:09.628;card;Americano with Milk;27,92
30/07/2024;2024-07-30 16:08:52.876;card;Cortado;23,02
30/07/2024;2024-07-30 16:09:43.627;card;Americano with Milk;27,92
30/07/2024;2024-07-30 20:24:19.874;card;Espresso;18,12
30/07/2024;2024-07-30 20:53:51.866;card;Americano with Milk;27,92
30/07/2024;2024-07-30 20:54:46.316;card;Americano with Milk;27,92
30/07/2024;2024-07-30 20:57:02.324;card;Americano with Milk;27,92
30/07/2024;2024-07-30 21:33:19.198;card;Latte;32,82
30/07/2024;2024-07-30 22:15:21.484;card;Americano;23,02
30/07/2024;2024-07-30 22:16:19.260;card;Cappuccino;32,82
31/07/2024;2024-07-31 07:59:52.098;card;Americano with Milk;27,92
31/07/2024;2024-07-31 08:37:41.943;card;Americano with Milk;27,92
31/07/2024;2024-07-31 08:38:38.236;card;Americano with Milk;27,92
31/07/2024;2024-07-31 09:54:45.315;card;Americano;23,02
31/07/2024;2024-07-31 09:55:45.142;card;Americano;23,02
31/07/2024;2024-07-31 09:58:15.863;card;Americano with Milk;27,92
31/07/2024;2024-07-31 13:11:42.609;card;Cocoa;32,82
31/07/2024;2024-07-31 13:14:00.286;card;Latte;32,82
31/07/2024;2024-07-31 13:24:49.437;card;Americano with Milk;27,92
31/07/2024;2024-07-31 17:48:06.787;card;Cortado;23,02
31/07/2024;2024-07-31 18:04:14.972;card;Latte;32,82
31/07/2024;2024-07-31 19:22:38.883;card;Cortado;23,02
31/07/2024;2024-07-31 19:28:45.141;card;Latte;32,82
31/07/2024;2024-07-31 20:46:42.418;card;Cocoa;32,82
31/07/2024;2024-07-31 20:50:07.411;card;Cortado;23,02
31/07/2024;2024-07-31 20:51:10.383;card;Latte;32,82
31/07/2024;2024-07-31 20:52:14.802;card;Cappuccino;32,82
31/07/2024;2024-07-31 20:53:35.077;card;Cortado;23,02
31/07/2024;2024-07-31 20:59:25.013;card;Americano with Milk;27,92
31/07/2024;2024-07-31 21:26:26.000;card;Latte;32,82
31/07/2024;2024-07-31 21:54:11.824;card;Latte;32,82
31/07/2024;2024-07-31 21:55:16.570;card;Latte;32,82
1/08/2024;2024-08-01 07:31:00.085;card;Americano with Milk;27,92
1/08/2024;2024-08-01 09:25:20.060;card;Americano with Milk;27,92
1/08/2024;2024-08-01 11:04:14.067;card;Americano with Milk;27,92
1/08/2024;2024-08-01 11:22:46.369;card;Americano with Milk;27,92
1/08/2024;2024-08-01 13:22:46.601;card;Cortado;23,02
1/08/2024;2024-08-01 13:23:37.314;card;Cappuccino;32,82
1/08/2024;2024-08-01 13:49:07.265;card;Cappuccino;32,82
1/08/2024;2024-08-01 15:43:43.820;card;Americano with Milk;27,92
1/08/2024;2024-08-01 16:24:00.663;card;Americano with Milk;27,92
1/08/2024;2024-08-01 16:26:07.331;card;Americano;23,02
1/08/2024;2024-08-01 17:23:35.238;card;Americano;23,02
1/08/2024;2024-08-01 20:41:28.118;card;Cappuccino;32,82
2/08/2024;2024-08-02 09:01:54.165;card;Americano with Milk;27,92
2/08/2024;2024-08-02 09:35:02.899;card;Americano with Milk;27,92
2/08/2024;2024-08-02 11:09:19.465;card;Cortado;23,02
2/08/2024;2024-08-02 18:08:35.282;card;Americano with Milk;27,92
2/08/2024;2024-08-02 21:23:04.359;card;Latte;32,82
3/08/2024;2024-08-03 08:53:46.651;card;Americano with Milk;27,92
3/08/2024;2024-08-03 09:37:19.213;card;Americano with Milk;27,92
3/08/2024;2024-08-03 09:38:41.010;card;Americano with Milk;27,92
3/08/2024;2024-08-03 10:12:25.650;card;Americano with Milk;27,92
3/08/2024;2024-08-03 11:20:26.571;card;Cortado;23,02
3/08/2024;2024-08-03 11:21:22.000;card;Cortado;23,02
3/08/2024;2024-08-03 11:56:36.628;card;Espresso;18,12
3/08/2024;2024-08-03 11:57:31.273;card;Americano with Milk;27,92
3/08/2024;2024-08-03 12:03:35.777;card;Americano with Milk;27,92
3/08/2024;2024-08-03 16:53:59.927;card;Americano with Milk;27,92
3/08/2024;2024-08-03 18:38:42.026;card;Cappuccino;32,82
3/08/2024;2024-08-03 21:30:48.958;card;Latte;32,82
3/08/2024;2024-08-03 21:33:06.265;card;Latte;32,82
4/08/2024;2024-08-04 08:18:37.314;card;Cappuccino;32,82
4/08/2024;2024-08-04 10:37:51.103;card;Americano with Milk;27,92
4/08/2024;2024-08-04 11:50:54.603;card;Cappuccino;32,82
4/08/2024;2024-08-04 11:52:33.017;card;Americano with Milk;27,92
4/08/2024;2024-08-04 15:33:52.137;card;Cappuccino;32,82
4/08/2024;2024-08-04 15:35:05.906;card;Cappuccino;32,82
5/08/2024;2024-08-05 08:50:05.753;card;Cortado;23,02
5/08/2024;2024-08-05 09:19:19.176;card;Americano with Milk;27,92
5/08/2024;2024-08-05 11:20:47.444;card;Cortado;23,02
5/08/2024;2024-08-05 13:45:22.454;card;Cappuccino;32,82
5/08/2024;2024-08-05 16:05:57.738;card;Latte;32,82
5/08/2024;2024-08-05 16:07:18.837;card;Latte;32,82
5/08/2024;2024-08-05 17:44:24.506;card;Latte;32,82
5/08/2024;2024-08-05 17:45:32.117;card;Americano with Milk;27,92
5/08/2024;2024-08-05 19:20:02.677;card;Latte;32,82
5/08/2024;2024-08-05 19:34:51.484;card;Latte;32,82
5/08/2024;2024-08-05 20:49:30.945;card;Cocoa;32,82
5/08/2024;2024-08-05 20:50:21.919;card;Cocoa;32,82
5/08/2024;2024-08-05 22:43:48.193;card;Americano with Milk;27,92
6/08/2024;2024-08-06 10:21:03.320;card;Cortado;23,02
6/08/2024;2024-08-06 10:32:32.335;card;Hot Chocolate;32,82
6/08/2024;2024-08-06 17:40:49.201;card;Cappuccino;32,82
6/08/2024;2024-08-06 17:42:52.700;card;Latte;32,82
6/08/2024;2024-08-06 17:44:05.067;card;Cocoa;32,82
6/08/2024;2024-08-06 19:04:04.544;card;Latte;32,82
6/08/2024;2024-08-06 19:05:23.110;card;Americano with Milk;27,92
6/08/2024;2024-08-06 20:04:27.133;card;Latte;32,82
7/08/2024;2024-08-07 08:55:48.455;card;Americano with Milk;27,92
7/08/2024;2024-08-07 12:12:26.800;card;Americano;23,02
7/08/2024;2024-08-07 12:13:40.664;card;Americano;23,02
7/08/2024;2024-08-07 13:11:16.155;card;Espresso;18,12
7/08/2024;2024-08-07 16:19:01.657;card;Americano;23,02
7/08/2024;2024-08-07 19:36:22.739;card;Latte;32,82
7/08/2024;2024-08-07 20:40:09.281;card;Cocoa;32,82
7/08/2024;2024-08-07 21:18:11.990;card;Cappuccino;32,82
7/08/2024;2024-08-07 22:28:56.686;card;Latte;32,82
7/08/2024;2024-08-07 22:32:15.971;card;Latte;32,82
8/08/2024;2024-08-08 08:46:36.204;card;Espresso;18,12
8/08/2024;2024-08-08 08:47:28.686;card;Cortado;23,02
8/08/2024;2024-08-08 12:27:05.373;card;Americano with Milk;27,92
8/08/2024;2024-08-08 12:43:19.558;card;Cortado;23,02
8/08/2024;2024-08-08 12:44:14.953;card;Cortado;23,02
8/08/2024;2024-08-08 16:57:53.266;card;Cappuccino;32,82
8/08/2024;2024-08-08 17:17:51.749;card;Cappuccino;32,82
8/08/2024;2024-08-08 21:25:59.265;card;Americano with Milk;27,92
9/08/2024;2024-08-09 07:35:22.340;card;Latte;32,82
9/08/2024;2024-08-09 09:53:34.553;card;Americano;23,02
9/08/2024;2024-08-09 10:13:07.537;card;Cortado;23,02
9/08/2024;2024-08-09 10:26:47.174;card;Americano with Milk;27,92
9/08/2024;2024-08-09 11:28:08.722;card;Latte;32,82
9/08/2024;2024-08-09 11:29:48.682;card;Americano;23,02
9/08/2024;2024-08-09 18:56:27.712;card;Americano;23,02
9/08/2024;2024-08-09 19:03:06.611;card;Hot Chocolate;32,82
10/08/2024;2024-08-10 08:36:44.628;card;Cappuccino;32,82
10/08/2024;2024-08-10 08:37:57.069;card;Americano with Milk;27,92
10/08/2024;2024-08-10 08:45:09.019;card;Cortado;23,02
10/08/2024;2024-08-10 11:52:33.836;card;Cortado;23,02
10/08/2024;2024-08-10 11:54:23.534;card;Americano;23,02
10/08/2024;2024-08-10 12:15:10.927;card;Latte;32,82
10/08/2024;2024-08-10 12:33:12.454;card;Americano with Milk;27,92
10/08/2024;2024-08-10 16:06:12.085;card;Latte;32,82
10/08/2024;2024-08-10 21:16:48.562;card;Cocoa;32,82
10/08/2024;2024-08-10 21:17:41.087;card;Cocoa;32,82
10/08/2024;2024-08-10 21:37:41.517;card;Cocoa;32,82
11/08/2024;2024-08-11 09:52:36.590;card;Latte;32,82
11/08/2024;2024-08-11 09:53:43.564;card;Latte;32,82
11/08/2024;2024-08-11 10:17:23.636;card;Americano with Milk;27,92
11/08/2024;2024-08-11 11:56:41.144;card;Cappuccino;32,82
11/08/2024;2024-08-11 11:57:41.269;card;Americano with Milk;27,92
11/08/2024;2024-08-11 12:20:19.570;card;Cortado;23,02
11/08/2024;2024-08-11 15:53:51.552;card;Latte;32,82
11/08/2024;2024-08-11 15:55:14.853;card;Americano with Milk;27,92
11/08/2024;2024-08-11 15:56:27.697;card;Cocoa;32,82
11/08/2024;2024-08-11 16:27:35.126;card;Cappuccino;32,82
11/08/2024;2024-08-11 16:28:38.296;card;Espresso;18,12
11/08/2024;2024-08-11 21:30:32.549;card;Cortado;23,02
11/08/2024;2024-08-11 21:41:09.070;card;Latte;32,82
11/08/2024;2024-08-11 21:43:10.108;card;Latte;32,82
11/08/2024;2024-08-11 22:39:29.913;card;Cappuccino;32,82
12/08/2024;2024-08-12 08:26:19.458;card;Hot Chocolate;32,82
12/08/2024;2024-08-12 11:15:04.771;card;Americano with Milk;27,92
12/08/2024;2024-08-12 11:19:29.513;card;Americano;23,02
12/08/2024;2024-08-12 11:20:23.640;card;Latte;32,82
12/08/2024;2024-08-12 11:44:28.384;card;Latte;32,82
12/08/2024;2024-08-12 14:04:03.399;card;Espresso;18,12
12/08/2024;2024-08-12 14:05:06.931;card;Americano with Milk;27,92
12/08/2024;2024-08-12 15:33:33.110;card;Americano with Milk;27,92
12/08/2024;2024-08-12 18:05:04.830;card;Americano with Milk;27,92
12/08/2024;2024-08-12 21:25:49.351;card;Americano with Milk;27,92
12/08/2024;2024-08-12 21:37:38.041;card;Latte;32,82
12/08/2024;2024-08-12 22:58:20.072;card;Cappuccino;32,82
12/08/2024;2024-08-12 22:59:18.544;card;Cappuccino;32,82
13/08/2024;2024-08-13 08:44:30.187;card;Americano with Milk;27,92
13/08/2024;2024-08-13 09:14:21.598;card;Americano with Milk;27,92
13/08/2024;2024-08-13 09:45:56.370;card;Americano with Milk;27,92
13/08/2024;2024-08-13 10:42:08.773;card;Cortado;23,02
13/08/2024;2024-08-13 11:59:47.612;card;Latte;32,82
13/08/2024;2024-08-13 13:01:41.487;card;Americano with Milk;27,92
13/08/2024;2024-08-13 14:45:39.689;card;Latte;32,82
13/08/2024;2024-08-13 15:47:56.703;card;Cappuccino;32,82
13/08/2024;2024-08-13 15:55:29.579;card;Americano with Milk;27,92
13/08/2024;2024-08-13 20:29:34.531;card;Latte;32,82
13/08/2024;2024-08-13 20:30:37.150;card;Cocoa;32,82
13/08/2024;2024-08-13 20:44:22.991;card;Cappuccino;32,82
13/08/2024;2024-08-13 21:00:44.688;card;Cortado;23,02
14/08/2024;2024-08-14 07:35:48.103;card;Latte;32,82
14/08/2024;2024-08-14 07:36:55.599;card;Cappuccino;32,82
14/08/2024;2024-08-14 10:09:29.125;card;Cortado;23,02
14/08/2024;2024-08-14 11:39:07.882;card;Espresso;18,12
14/08/2024;2024-08-14 12:49:16.951;card;Americano;23,02
14/08/2024;2024-08-14 12:51:04.870;card;Americano;23,02
14/08/2024;2024-08-14 15:21:27.260;card;Latte;32,82
14/08/2024;2024-08-14 17:24:22.788;card;Americano;23,02
14/08/2024;2024-08-14 18:10:03.723;card;Cortado;23,02
14/08/2024;2024-08-14 18:59:18.279;card;Americano with Milk;27,92
14/08/2024;2024-08-14 19:34:51.731;card;Latte;32,82
14/08/2024;2024-08-14 19:35:48.545;card;Cortado;23,02
14/08/2024;2024-08-14 21:41:33.021;card;Latte;32,82
15/08/2024;2024-08-15 09:36:11.153;card;Cortado;23,02
15/08/2024;2024-08-15 09:37:02.172;card;Cappuccino;32,82
15/08/2024;2024-08-15 09:38:04.903;card;Hot Chocolate;32,82
15/08/2024;2024-08-15 09:38:49.735;card;Latte;32,82
15/08/2024;2024-08-15 12:38:37.563;card;Latte;32,82
15/08/2024;2024-08-15 13:48:13.601;card;Latte;32,82
15/08/2024;2024-08-15 14:17:48.183;card;Americano;23,02
15/08/2024;2024-08-15 14:18:50.777;card;Espresso;18,12
15/08/2024;2024-08-15 17:53:52.225;card;Americano with Milk;27,92
15/08/2024;2024-08-15 19:10:58.222;card;Hot Chocolate;32,82
15/08/2024;2024-08-15 19:11:54.036;card;Americano with Milk;27,92
15/08/2024;2024-08-15 19:41:30.244;card;Americano with Milk;27,92
15/08/2024;2024-08-15 19:42:37.987;card;Americano;23,02
15/08/2024;2024-08-15 20:40:41.516;card;Cappuccino;32,82
15/08/2024;2024-08-15 21:35:20.080;card;Espresso;18,12
15/08/2024;2024-08-15 21:36:11.033;card;Americano with Milk;27,92
16/08/2024;2024-08-16 12:29:16.732;card;Latte;32,82
16/08/2024;2024-08-16 12:54:17.452;card;Americano;23,02
16/08/2024;2024-08-16 13:36:12.798;card;Americano with Milk;27,92
16/08/2024;2024-08-16 15:18:51.737;card;Espresso;18,12
16/08/2024;2024-08-16 15:19:39.274;card;Espresso;18,12
17/08/2024;2024-08-17 09:16:53.491;card;Americano with Milk;27,92
17/08/2024;2024-08-17 09:18:08.983;card;Cappuccino;32,82
17/08/2024;2024-08-17 10:53:41.327;card;Americano with Milk;27,92
17/08/2024;2024-08-17 11:58:41.649;card;Cortado;23,02
17/08/2024;2024-08-17 11:59:28.298;card;Cortado;23,02
17/08/2024;2024-08-17 13:18:40.184;card;Americano with Milk;27,92
17/08/2024;2024-08-17 16:31:54.837;card;Cortado;23,02
17/08/2024;2024-08-17 16:33:48.977;card;Latte;32,82
17/08/2024;2024-08-17 18:48:58.852;card;Cappuccino;32,82
17/08/2024;2024-08-17 21:18:56.806;card;Americano with Milk;27,92
17/08/2024;2024-08-17 22:42:39.351;card;Latte;32,82
18/08/2024;2024-08-18 08:09:42.601;card;Cappuccino;32,82
18/08/2024;2024-08-18 08:32:05.597;card;Cappuccino;32,82
18/08/2024;2024-08-18 08:41:06.249;card;Cortado;23,02
18/08/2024;2024-08-18 08:56:01.292;card;Americano with Milk;27,92
18/08/2024;2024-08-18 12:31:40.892;card;Cappuccino;32,82
18/08/2024;2024-08-18 14:30:21.605;card;Americano with Milk;27,92
18/08/2024;2024-08-18 18:24:10.776;card;Americano with Milk;27,92
18/08/2024;2024-08-18 18:26:03.786;card;Americano with Milk;27,92
18/08/2024;2024-08-18 18:27:17.553;card;Americano;23,02
18/08/2024;2024-08-18 18:28:13.069;card;Americano;23,02
19/08/2024;2024-08-19 15:09:48.982;card;Americano with Milk;27,92
19/08/2024;2024-08-19 15:10:51.212;card;Americano with Milk;27,92
19/08/2024;2024-08-19 21:21:12.081;card;Latte;32,82
19/08/2024;2024-08-19 21:31:57.036;card;Cocoa;32,82
20/08/2024;2024-08-20 08:27:16.408;card;Cortado;23,02
20/08/2024;2024-08-20 08:29:14.916;card;Latte;32,82
20/08/2024;2024-08-20 08:49:47.474;card;Espresso;18,12
20/08/2024;2024-08-20 08:50:36.343;card;Cortado;23,02
20/08/2024;2024-08-20 09:14:54.885;card;Americano with Milk;27,92
20/08/2024;2024-08-20 11:09:55.575;card;Americano;23,02
20/08/2024;2024-08-20 11:11:39.083;card;Americano;23,02
20/08/2024;2024-08-20 11:12:31.181;card;Americano;23,02
20/08/2024;2024-08-20 11:42:20.000;card;Latte;32,82
20/08/2024;2024-08-20 20:42:40.873;card;Latte;32,82
20/08/2024;2024-08-20 20:44:14.852;card;Latte;32,82
20/08/2024;2024-08-20 20:45:12.346;card;Latte;32,82
20/08/2024;2024-08-20 20:46:03.989;card;Latte;32,82
21/08/2024;2024-08-21 07:59:13.098;card;Americano with Milk;27,92
21/08/2024;2024-08-21 08:40:27.393;card;Cortado;23,02
21/08/2024;2024-08-21 10:13:32.404;card;Americano;23,02
21/08/2024;2024-08-21 10:38:44.527;card;Americano with Milk;27,92
21/08/2024;2024-08-21 11:51:41.439;card;Cortado;23,02
21/08/2024;2024-08-21 13:17:10.750;card;Latte;32,82
21/08/2024;2024-08-21 19:42:03.523;card;Latte;32,82
22/08/2024;2024-08-22 09:22:26.297;card;Cortado;23,02
22/08/2024;2024-08-22 10:09:23.470;card;Americano with Milk;27,92
22/08/2024;2024-08-22 10:47:59.356;card;Americano with Milk;27,92
22/08/2024;2024-08-22 14:16:12.066;card;Latte;32,82
22/08/2024;2024-08-22 14:26:58.298;card;Latte;32,82
22/08/2024;2024-08-22 15:07:07.427;card;Cappuccino;32,82
22/08/2024;2024-08-22 15:27:27.317;card;Americano;23,02
23/08/2024;2024-08-23 07:43:16.127;card;Latte;32,82
23/08/2024;2024-08-23 08:21:48.054;card;Cortado;23,02
23/08/2024;2024-08-23 08:22:56.567;card;Latte;32,82
23/08/2024;2024-08-23 08:33:38.712;card;Americano;23,02
23/08/2024;2024-08-23 08:34:35.002;card;Americano;23,02
23/08/2024;2024-08-23 09:14:52.024;card;Americano with Milk;27,92
23/08/2024;2024-08-23 10:10:58.704;card;Cocoa;32,82
23/08/2024;2024-08-23 10:11:55.469;card;Americano;23,02
23/08/2024;2024-08-23 10:39:12.279;card;Cortado;23,02
23/08/2024;2024-08-23 11:12:59.387;card;Hot Chocolate;32,82
23/08/2024;2024-08-23 13:24:54.748;card;Americano;23,02
23/08/2024;2024-08-23 15:28:52.779;card;Americano;23,02
23/08/2024;2024-08-23 19:48:02.807;card;Latte;32,82
24/08/2024;2024-08-24 08:13:42.270;card;Cortado;23,02
24/08/2024;2024-08-24 08:14:47.637;card;Cortado;23,02
24/08/2024;2024-08-24 08:44:11.575;card;Cortado;23,02
24/08/2024;2024-08-24 10:18:09.485;card;Espresso;18,12
24/08/2024;2024-08-24 10:18:52.263;card;Espresso;18,12
24/08/2024;2024-08-24 10:19:49.243;card;Americano;23,02
25/08/2024;2024-08-25 08:14:37.382;card;Cortado;23,02
25/08/2024;2024-08-25 08:26:27.671;card;Americano;23,02
25/08/2024;2024-08-25 08:27:36.405;card;Americano;23,02
25/08/2024;2024-08-25 09:24:22.265;card;Cappuccino;32,82
25/08/2024;2024-08-25 12:41:42.703;card;Cappuccino;32,82
25/08/2024;2024-08-25 14:53:02.699;card;Latte;32,82
26/08/2024;2024-08-26 08:11:47.295;card;Cortado;23,02
26/08/2024;2024-08-26 08:16:09.611;card;Americano;23,02
26/08/2024;2024-08-26 08:17:23.209;card;Americano;23,02
26/08/2024;2024-08-26 09:21:36.706;card;Americano with Milk;27,92
26/08/2024;2024-08-26 10:37:44.464;card;Latte;32,82
26/08/2024;2024-08-26 10:38:49.037;card;Cappuccino;32,82
26/08/2024;2024-08-26 12:45:13.158;card;Americano;23,02
26/08/2024;2024-08-26 12:46:23.644;card;Americano;23,02
26/08/2024;2024-08-26 18:53:27.790;card;Americano with Milk;27,92
26/08/2024;2024-08-26 18:54:31.291;card;Latte;32,82
26/08/2024;2024-08-26 22:55:39.905;card;Americano with Milk;27,92
27/08/2024;2024-08-27 10:04:04.563;card;Latte;32,82
28/08/2024;2024-08-28 12:08:18.772;card;Americano with Milk;27,92
28/08/2024;2024-08-28 12:10:04.139;card;Cappuccino;32,82
28/08/2024;2024-08-28 12:35:06.944;card;Americano;23,02
28/08/2024;2024-08-28 13:48:35.199;card;Americano with Milk;27,92
29/08/2024;2024-08-29 07:29:30.319;card;Americano;23,02
30/08/2024;2024-08-30 17:13:30.487;card;Latte;32,82
30/08/2024;2024-08-30 17:14:32.791;card;Americano with Milk;27,92
30/08/2024;2024-08-30 17:15:35.449;card;Americano with Milk;27,92
31/08/2024;2024-08-31 09:08:32.487;card;Cortado;23,02
31/08/2024;2024-08-31 10:02:08.193;card;Americano with Milk;27,92
31/08/2024;2024-08-31 10:22:26.877;card;Espresso;18,12
31/08/2024;2024-08-31 11:29:54.571;card;Americano with Milk;27,92
31/08/2024;2024-08-31 11:33:39.916;card;Cortado;23,02
31/08/2024;2024-08-31 11:34:32.934;card;Cortado;23,02
1/09/2024;2024-09-01 09:34:15.229;card;Cortado;23,02
1/09/2024;2024-09-01 12:11:24.745;card;Cappuccino;32,82
1/09/2024;2024-09-01 12:30:08.620;card;Americano with Milk;27,92
1/09/2024;2024-09-01 12:32:22.007;card;Americano;23,02
1/09/2024;2024-09-01 12:50:17.448;card;Americano with Milk;27,92
1/09/2024;2024-09-01 13:57:33.948;card;Latte;32,82
1/09/2024;2024-09-01 14:44:04.027;card;Americano with Milk;27,92
1/09/2024;2024-09-01 17:20:46.327;card;Latte;32,82
1/09/2024;2024-09-01 17:23:13.869;card;Latte;32,82
1/09/2024;2024-09-01 17:24:49.689;card;Latte;32,82
2/09/2024;2024-09-02 08:24:39.805;card;Latte;32,82
2/09/2024;2024-09-02 08:50:17.646;card;Americano with Milk;27,92
2/09/2024;2024-09-02 08:51:33.148;card;Latte;32,82
2/09/2024;2024-09-02 14:58:47.143;card;Americano with Milk;27,92
2/09/2024;2024-09-02 20:09:43.923;card;Cappuccino;32,82
2/09/2024;2024-09-02 20:11:17.936;card;Cocoa;32,82
2/09/2024;2024-09-02 20:52:31.984;card;Americano;23,02
2/09/2024;2024-09-02 20:53:29.090;card;Americano;23,02
3/09/2024;2024-09-03 08:22:15.368;card;Cocoa;32,82
3/09/2024;2024-09-03 08:28:12.430;card;Cappuccino;32,82
3/09/2024;2024-09-03 08:41:11.698;card;Latte;32,82
3/09/2024;2024-09-03 09:03:12.473;card;Americano with Milk;27,92
3/09/2024;2024-09-03 09:04:11.750;card;Cappuccino;32,82
3/09/2024;2024-09-03 09:12:48.154;card;Cocoa;32,82
3/09/2024;2024-09-03 09:13:33.655;card;Cocoa;32,82
3/09/2024;2024-09-03 09:17:02.210;card;Americano with Milk;27,92
3/09/2024;2024-09-03 09:20:17.170;card;Americano with Milk;27,92
3/09/2024;2024-09-03 09:37:52.322;card;Latte;32,82
3/09/2024;2024-09-03 09:38:56.399;card;Cocoa;32,82
3/09/2024;2024-09-03 12:56:53.409;card;Cortado;23,02
3/09/2024;2024-09-03 14:14:51.711;card;Americano with Milk;27,92
3/09/2024;2024-09-03 14:16:17.337;card;Americano with Milk;27,92
3/09/2024;2024-09-03 18:48:34.747;card;Americano with Milk;27,92
3/09/2024;2024-09-03 19:11:12.312;card;Latte;32,82
3/09/2024;2024-09-03 19:17:13.808;card;Americano with Milk;27,92
4/09/2024;2024-09-04 11:11:21.574;card;Americano with Milk;27,92
4/09/2024;2024-09-04 11:33:36.598;card;Latte;32,82
4/09/2024;2024-09-04 11:48:03.543;card;Americano;23,02
4/09/2024;2024-09-04 11:55:34.487;card;Americano with Milk;27,92
4/09/2024;2024-09-04 12:53:31.320;card;Latte;32,82
4/09/2024;2024-09-04 13:03:50.610;card;Latte;32,82
4/09/2024;2024-09-04 13:05:16.100;card;Americano with Milk;27,92
4/09/2024;2024-09-04 18:03:46.925;card;Cappuccino;32,82
4/09/2024;2024-09-04 19:41:41.962;card;Americano with Milk;27,92
4/09/2024;2024-09-04 21:19:35.649;card;Latte;32,82
5/09/2024;2024-09-05 09:31:17.020;card;Americano with Milk;27,92
5/09/2024;2024-09-05 10:28:56.227;card;Americano with Milk;27,92
5/09/2024;2024-09-05 11:06:30.599;card;Americano;23,02
5/09/2024;2024-09-05 14:00:27.732;card;Latte;32,82
5/09/2024;2024-09-05 15:25:12.342;card;Latte;32,82
5/09/2024;2024-09-05 16:38:50.385;card;Americano;23,02
5/09/2024;2024-09-05 16:39:59.634;card;Americano with Milk;27,92
5/09/2024;2024-09-05 17:04:28.905;card;Cappuccino;32,82
5/09/2024;2024-09-05 17:05:31.684;card;Cappuccino;32,82
5/09/2024;2024-09-05 20:30:14.964;card;Cappuccino;32,82
5/09/2024;2024-09-05 20:54:24.429;card;Americano;23,02
5/09/2024;2024-09-05 20:55:31.429;card;Cappuccino;32,82
5/09/2024;2024-09-05 21:26:28.836;card;Americano with Milk;27,92
5/09/2024;2024-09-05 21:27:29.969;card;Americano with Milk;27,92
6/09/2024;2024-09-06 08:25:33.870;card;Cappuccino;32,82
6/09/2024;2024-09-06 08:34:46.827;card;Latte;32,82
6/09/2024;2024-09-06 08:54:41.950;card;Americano;23,02
6/09/2024;2024-09-06 09:50:39.949;card;Espresso;18,12
6/09/2024;2024-09-06 09:51:52.216;card;Latte;32,82
6/09/2024;2024-09-06 10:30:06.049;card;Hot Chocolate;32,82
6/09/2024;2024-09-06 11:23:25.390;card;Espresso;18,12
6/09/2024;2024-09-06 11:24:29.254;card;Espresso;18,12
6/09/2024;2024-09-06 20:00:12.025;card;Latte;32,82
6/09/2024;2024-09-06 21:09:31.247;card;Latte;32,82
7/09/2024;2024-09-07 08:48:57.014;card;Latte;32,82
7/09/2024;2024-09-07 09:52:02.999;card;Cortado;23,02
7/09/2024;2024-09-07 09:53:03.575;card;Cortado;23,02
7/09/2024;2024-09-07 09:54:41.613;card;Cortado;23,02
7/09/2024;2024-09-07 09:57:47.652;card;Americano with Milk;27,92
7/09/2024;2024-09-07 09:59:02.310;card;Americano with Milk;27,92
7/09/2024;2024-09-07 10:00:19.683;card;Cortado;23,02
7/09/2024;2024-09-07 10:22:44.518;card;Americano;23,02
7/09/2024;2024-09-07 10:37:52.335;card;Espresso;18,12
7/09/2024;2024-09-07 10:40:12.607;card;Espresso;18,12
7/09/2024;2024-09-07 10:53:32.221;card;Latte;32,82
7/09/2024;2024-09-07 11:18:56.767;card;Americano with Milk;27,92
7/09/2024;2024-09-07 11:20:00.022;card;Americano;23,02
7/09/2024;2024-09-07 11:20:57.101;card;Espresso;18,12
7/09/2024;2024-09-07 15:55:08.533;card;Latte;32,82
7/09/2024;2024-09-07 16:20:01.025;card;Americano;23,02
7/09/2024;2024-09-07 16:20:59.312;card;Espresso;18,12
7/09/2024;2024-09-07 19:35:04.937;card;Cocoa;32,82
7/09/2024;2024-09-07 19:36:05.056;card;Latte;32,82
7/09/2024;2024-09-07 19:37:15.515;card;Latte;32,82
7/09/2024;2024-09-07 20:13:51.672;card;Latte;32,82
7/09/2024;2024-09-07 20:14:59.212;card;Latte;32,82
8/09/2024;2024-09-08 08:15:40.805;card;Cortado;23,02
8/09/2024;2024-09-08 09:18:17.027;card;Cortado;23,02
8/09/2024;2024-09-08 09:19:12.416;card;Cortado;23,02
8/09/2024;2024-09-08 10:05:56.145;card;Cortado;23,02
8/09/2024;2024-09-08 12:43:28.027;card;Cortado;23,02
8/09/2024;2024-09-08 20:13:32.864;card;Americano;23,02
9/09/2024;2024-09-09 07:51:13.564;card;Latte;32,82
9/09/2024;2024-09-09 07:53:51.556;card;Cappuccino;32,82
9/09/2024;2024-09-09 07:55:21.584;card;Americano with Milk;27,92
9/09/2024;2024-09-09 07:56:37.669;card;Latte;32,82
9/09/2024;2024-09-09 09:49:50.704;card;Latte;32,82
9/09/2024;2024-09-09 09:50:51.738;card;Hot Chocolate;32,82
9/09/2024;2024-09-09 09:59:10.750;card;Latte;32,82
9/09/2024;2024-09-09 11:11:36.122;card;Americano with Milk;27,92
9/09/2024;2024-09-09 11:12:50.640;card;Americano with Milk;27,92
9/09/2024;2024-09-09 11:29:49.243;card;Latte;32,82
9/09/2024;2024-09-09 12:06:59.657;card;Espresso;18,12
9/09/2024;2024-09-09 15:12:13.766;card;Latte;32,82
9/09/2024;2024-09-09 15:13:24.517;card;Americano;23,02
9/09/2024;2024-09-09 17:24:10.388;card;Latte;32,82
9/09/2024;2024-09-09 18:13:46.320;card;Latte;32,82
9/09/2024;2024-09-09 20:07:36.198;card;Cappuccino;32,82
9/09/2024;2024-09-09 20:13:43.524;card;Latte;32,82
10/09/2024;2024-09-10 08:12:02.450;card;Hot Chocolate;32,82
10/09/2024;2024-09-10 09:32:46.786;card;Cappuccino;32,82
10/09/2024;2024-09-10 15:21:54.387;card;Cortado;23,02
10/09/2024;2024-09-10 15:23:05.946;card;Cortado;23,02
10/09/2024;2024-09-10 18:43:41.760;card;Cappuccino;32,82
10/09/2024;2024-09-10 18:45:22.624;card;Americano with Milk;27,92
10/09/2024;2024-09-10 19:02:43.027;card;Latte;32,82
10/09/2024;2024-09-10 19:03:53.257;card;Latte;32,82
10/09/2024;2024-09-10 21:29:34.556;card;Americano with Milk;27,92
10/09/2024;2024-09-10 21:30:27.036;card;Americano;23,02
11/09/2024;2024-09-11 08:47:22.305;card;Latte;32,82
11/09/2024;2024-09-11 09:28:46.757;card;Americano with Milk;27,92
11/09/2024;2024-09-11 10:52:09.177;card;Latte;32,82
11/09/2024;2024-09-11 19:53:12.537;card;Cappuccino;32,82
11/09/2024;2024-09-11 20:13:14.887;card;Americano with Milk;27,92
11/09/2024;2024-09-11 20:14:18.886;card;Latte;32,82
11/09/2024;2024-09-11 20:15:19.350;card;Latte;32,82
11/09/2024;2024-09-11 21:01:34.225;card;Cortado;23,02
12/09/2024;2024-09-12 10:57:25.619;card;Espresso;18,12
12/09/2024;2024-09-12 10:58:19.807;card;Americano with Milk;27,92
12/09/2024;2024-09-12 11:27:36.065;card;Americano with Milk;27,92
12/09/2024;2024-09-12 12:08:22.158;card;Cappuccino;32,82
12/09/2024;2024-09-12 12:31:06.997;card;Cortado;23,02
12/09/2024;2024-09-12 12:32:22.981;card;Cortado;23,02
12/09/2024;2024-09-12 12:37:20.423;card;Cortado;23,02
12/09/2024;2024-09-12 12:38:09.735;card;Cortado;23,02
12/09/2024;2024-09-12 17:01:25.224;card;Latte;32,82
12/09/2024;2024-09-12 21:09:10.412;card;Americano;23,02
12/09/2024;2024-09-12 21:10:21.159;card;Cappuccino;32,82
12/09/2024;2024-09-12 21:13:16.808;card;Cortado;23,02
13/09/2024;2024-09-13 07:56:53.763;card;Latte;32,82
13/09/2024;2024-09-13 08:41:02.985;card;Latte;32,82
13/09/2024;2024-09-13 08:54:15.814;card;Latte;32,82
13/09/2024;2024-09-13 09:51:19.387;card;Latte;32,82
13/09/2024;2024-09-13 15:38:18.869;card;Americano with Milk;27,92
13/09/2024;2024-09-13 15:50:53.892;card;Americano with Milk;27,92
14/09/2024;2024-09-14 16:29:19.359;card;Cappuccino;32,82
14/09/2024;2024-09-14 16:30:16.873;card;Cappuccino;32,82
15/09/2024;2024-09-15 08:42:40.941;card;Espresso;18,12
15/09/2024;2024-09-15 09:49:38.741;card;Americano with Milk;27,92
15/09/2024;2024-09-15 13:49:37.387;card;Americano;23,02
15/09/2024;2024-09-15 14:36:19.287;card;Cortado;23,02
15/09/2024;2024-09-15 14:37:20.597;card;Cortado;23,02
15/09/2024;2024-09-15 14:53:18.708;card;Cappuccino;32,82
16/09/2024;2024-09-16 13:32:22.875;card;Latte;32,82
16/09/2024;2024-09-16 13:33:36.767;card;Americano with Milk;27,92
16/09/2024;2024-09-16 15:23:19.260;card;Latte;32,82
16/09/2024;2024-09-16 17:16:05.734;card;Americano with Milk;27,92
16/09/2024;2024-09-16 17:18:03.251;card;Latte;32,82
16/09/2024;2024-09-16 18:54:45.448;card;Latte;32,82
16/09/2024;2024-09-16 18:56:05.275;card;Latte;32,82
16/09/2024;2024-09-16 21:10:18.693;card;Americano with Milk;27,92
16/09/2024;2024-09-16 21:11:32.500;card;Latte;32,82
16/09/2024;2024-09-16 21:37:47.308;card;Americano with Milk;27,92
16/09/2024;2024-09-16 21:38:48.666;card;Americano with Milk;27,92
17/09/2024;2024-09-17 07:54:57.927;card;Cortado;23,02
17/09/2024;2024-09-17 08:09:00.896;card;Latte;32,82
17/09/2024;2024-09-17 08:37:37.553;card;Americano with Milk;27,92
17/09/2024;2024-09-17 08:42:31.474;card;Cortado;23,02
17/09/2024;2024-09-17 09:10:03.755;card;Cappuccino;32,82
17/09/2024;2024-09-17 09:11:08.221;card;Americano with Milk;27,92
17/09/2024;2024-09-17 09:34:56.760;card;Americano with Milk;27,92
17/09/2024;2024-09-17 12:38:33.768;card;Espresso;18,12
17/09/2024;2024-09-17 12:39:33.682;card;Americano with Milk;27,92
17/09/2024;2024-09-17 12:44:15.152;card;Latte;32,82
17/09/2024;2024-09-17 13:54:23.032;card;Americano with Milk;27,92
17/09/2024;2024-09-17 13:55:31.241;card;Cortado;23,02
17/09/2024;2024-09-17 16:29:37.216;card;Cappuccino;32,82
17/09/2024;2024-09-17 16:31:00.716;card;Latte;32,82
17/09/2024;2024-09-17 18:54:23.783;card;Hot Chocolate;32,82
17/09/2024;2024-09-17 19:00:45.913;card;Americano with Milk;27,92
17/09/2024;2024-09-17 19:03:53.274;card;Americano with Milk;27,92
17/09/2024;2024-09-17 19:12:47.905;card;Latte;32,82
17/09/2024;2024-09-17 19:13:59.742;card;Americano with Milk;27,92
17/09/2024;2024-09-17 19:14:59.513;card;Americano with Milk;27,92
17/09/2024;2024-09-17 19:31:57.368;card;Americano with Milk;27,92
17/09/2024;2024-09-17 22:19:35.981;card;Hot Chocolate;32,82
17/09/2024;2024-09-17 22:20:19.450;card;Hot Chocolate;32,82
18/09/2024;2024-09-18 14:29:48.898;card;Latte;32,82
18/09/2024;2024-09-18 17:34:19.665;card;Latte;32,82
18/09/2024;2024-09-18 21:15:38.758;card;Americano with Milk;27,92
18/09/2024;2024-09-18 21:18:21.554;card;Americano with Milk;27,92
19/09/2024;2024-09-19 08:17:18.665;card;Americano with Milk;27,92
19/09/2024;2024-09-19 08:30:29.047;card;Cortado;23,02
19/09/2024;2024-09-19 10:01:30.579;card;Latte;32,82
19/09/2024;2024-09-19 12:59:33.614;card;Americano;23,02
19/09/2024;2024-09-19 13:00:33.616;card;Americano with Milk;27,92
19/09/2024;2024-09-19 13:45:42.367;card;Cortado;23,02
20/09/2024;2024-09-20 08:34:56.930;card;Americano with Milk;27,92
20/09/2024;2024-09-20 09:46:15.400;card;Americano with Milk;27,92
20/09/2024;2024-09-20 13:39:55.465;card;Americano with Milk;27,92
20/09/2024;2024-09-20 16:03:29.611;card;Latte;32,82
20/09/2024;2024-09-20 20:39:23.129;card;Americano;23,02
20/09/2024;2024-09-20 21:31:36.580;card;Americano with Milk;27,92
20/09/2024;2024-09-20 21:32:43.025;card;Americano with Milk;27,92
21/09/2024;2024-09-21 11:01:14.948;card;Latte;32,82
21/09/2024;2024-09-21 11:02:13.802;card;Cocoa;32,82
21/09/2024;2024-09-21 11:37:47.243;card;Cortado;23,02
21/09/2024;2024-09-21 11:38:44.997;card;Cortado;23,02
21/09/2024;2024-09-21 15:10:09.368;card;Cappuccino;32,82
21/09/2024;2024-09-21 15:36:13.609;card;Latte;32,82
21/09/2024;2024-09-21 18:16:28.701;card;Latte;32,82
21/09/2024;2024-09-21 18:17:30.686;card;Latte;32,82
21/09/2024;2024-09-21 20:29:42.939;card;Americano;23,02
21/09/2024;2024-09-21 20:30:38.882;card;Americano;23,02
21/09/2024;2024-09-21 20:33:58.175;card;Latte;32,82
21/09/2024;2024-09-21 20:35:30.169;card;Latte;32,82
21/09/2024;2024-09-21 22:18:46.088;card;Americano with Milk;27,92
21/09/2024;2024-09-21 22:19:50.128;card;Americano;23,02
21/09/2024;2024-09-21 22:20:48.360;card;Americano;23,02
22/09/2024;2024-09-22 08:32:54.172;card;Americano;23,02
22/09/2024;2024-09-22 10:12:09.764;card;Americano with Milk;27,92
22/09/2024;2024-09-22 10:13:08.586;card;Latte;32,82
22/09/2024;2024-09-22 11:06:26.307;card;Cortado;23,02
22/09/2024;2024-09-22 11:07:36.380;card;Cortado;23,02
22/09/2024;2024-09-22 11:51:59.888;card;Americano with Milk;27,92
22/09/2024;2024-09-22 11:55:12.923;card;Americano;23,02
22/09/2024;2024-09-22 12:07:20.767;card;Americano with Milk;27,92
22/09/2024;2024-09-22 13:28:14.663;card;Americano with Milk;27,92
22/09/2024;2024-09-22 13:29:35.917;card;Americano with Milk;27,92
22/09/2024;2024-09-22 13:33:34.561;card;Americano with Milk;27,92
22/09/2024;2024-09-22 15:34:10.099;card;Latte;32,82
22/09/2024;2024-09-22 15:35:24.234;card;Americano with Milk;27,92
22/09/2024;2024-09-22 16:25:03.468;card;Cocoa;32,82
22/09/2024;2024-09-22 20:19:10.082;card;Latte;32,82
22/09/2024;2024-09-22 20:20:35.589;card;Cappuccino;32,82
22/09/2024;2024-09-22 20:46:26.208;card;Americano with Milk;27,92
22/09/2024;2024-09-22 20:47:35.096;card;Americano with Milk;27,92
22/09/2024;2024-09-22 21:07:04.794;card;Americano with Milk;27,92
22/09/2024;2024-09-22 21:08:14.798;card;Americano with Milk;27,92
22/09/2024;2024-09-22 21:54:04.098;card;Hot Chocolate;32,82
22/09/2024;2024-09-22 21:54:54.497;card;Hot Chocolate;32,82
22/09/2024;2024-09-22 22:37:02.384;card;Americano;23,02
22/09/2024;2024-09-22 22:37:58.406;card;Americano with Milk;27,92
23/09/2024;2024-09-23 09:03:36.954;card;Americano with Milk;27,92
23/09/2024;2024-09-23 10:04:17.268;card;Cortado;23,02
23/09/2024;2024-09-23 12:11:04.352;card;Americano;23,02
23/09/2024;2024-09-23 14:08:51.946;card;Americano with Milk;27,92
23/09/2024;2024-09-23 17:27:47.591;card;Cappuccino;32,82
23/09/2024;2024-09-23 18:48:30.436;card;Americano;23,02
23/09/2024;2024-09-23 19:47:21.950;card;Latte;32,82
23/09/2024;2024-09-23 20:09:45.867;card;Cappuccino;32,82
23/09/2024;2024-09-23 22:13:30.513;card;Americano with Milk;27,92
23/09/2024;2024-09-23 22:15:14.958;card;Americano with Milk;27,92
24/09/2024;2024-09-24 08:33:32.613;card;Americano with Milk;27,92
24/09/2024;2024-09-24 12:23:56.963;card;Latte;32,82
24/09/2024;2024-09-24 12:24:54.750;card;Latte;32,82
24/09/2024;2024-09-24 12:46:44.403;card;Latte;32,82
24/09/2024;2024-09-24 12:47:49.424;card;Latte;32,82
24/09/2024;2024-09-24 14:11:39.339;card;Latte;32,82
24/09/2024;2024-09-24 14:31:28.741;card;Cortado;23,02
24/09/2024;2024-09-24 15:37:23.698;card;Cappuccino;32,82
24/09/2024;2024-09-24 16:38:48.296;card;Latte;32,82
24/09/2024;2024-09-24 18:43:02.935;card;Americano;23,02
24/09/2024;2024-09-24 18:43:54.082;card;Americano;23,02
24/09/2024;2024-09-24 20:15:50.396;card;Hot Chocolate;32,82
24/09/2024;2024-09-24 21:05:14.190;card;Latte;32,82
24/09/2024;2024-09-24 21:06:32.402;card;Americano with Milk;27,92
24/09/2024;2024-09-24 21:07:34.965;card;Americano with Milk;27,92
25/09/2024;2024-09-25 07:51:21.100;card;Cappuccino;32,82
25/09/2024;2024-09-25 11:35:32.533;card;Cortado;23,02
25/09/2024;2024-09-25 11:51:15.212;card;Americano with Milk;27,92
25/09/2024;2024-09-25 11:52:53.371;card;Latte;32,82
25/09/2024;2024-09-25 13:54:51.454;card;Americano with Milk;27,92
25/09/2024;2024-09-25 13:55:59.258;card;Americano with Milk;27,92
25/09/2024;2024-09-25 17:36:37.182;card;Americano with Milk;27,92
25/09/2024;2024-09-25 17:37:31.840;card;Americano with Milk;27,92
25/09/2024;2024-09-25 21:34:41.289;card;Americano;23,02
25/09/2024;2024-09-25 22:18:51.754;card;Americano with Milk;27,92
26/09/2024;2024-09-26 08:43:35.049;card;Latte;32,82
26/09/2024;2024-09-26 10:37:06.485;card;Americano with Milk;27,92
26/09/2024;2024-09-26 10:55:52.407;card;Espresso;18,12
26/09/2024;2024-09-26 11:34:48.571;card;Cappuccino;32,82
26/09/2024;2024-09-26 12:48:01.368;card;Latte;32,82
26/09/2024;2024-09-26 18:21:55.733;card;Latte;32,82
26/09/2024;2024-09-26 22:45:15.081;card;Latte;32,82
26/09/2024;2024-09-26 22:46:17.637;card;Cortado;23,02
26/09/2024;2024-09-26 22:47:24.867;card;Americano with Milk;27,92
27/09/2024;2024-09-27 09:29:45.646;card;Americano with Milk;27,92
27/09/2024;2024-09-27 09:33:43.977;card;Cortado;23,02
27/09/2024;2024-09-27 09:41:04.732;card;Cappuccino;32,82
27/09/2024;2024-09-27 10:46:56.620;card;Americano with Milk;27,92
27/09/2024;2024-09-27 11:35:00.282;card;Americano with Milk;27,92
27/09/2024;2024-09-27 13:20:31.055;card;Cappuccino;32,82
27/09/2024;2024-09-27 13:25:05.272;card;Cappuccino;32,82
27/09/2024;2024-09-27 13:28:33.107;card;Americano;23,02
27/09/2024;2024-09-27 13:33:52.455;card;Americano with Milk;27,92
27/09/2024;2024-09-27 18:07:43.705;card;Latte;32,82
27/09/2024;2024-09-27 18:08:58.239;card;Latte;32,82
27/09/2024;2024-09-27 18:37:45.891;card;Cappuccino;32,82
27/09/2024;2024-09-27 18:40:53.757;card;Cappuccino;32,82
27/09/2024;2024-09-27 20:18:13.287;card;Cappuccino;32,82
27/09/2024;2024-09-27 20:19:14.319;card;Cappuccino;32,82
27/09/2024;2024-09-27 20:58:14.967;card;Americano with Milk;27,92
28/09/2024;2024-09-28 08:06:45.469;card;Americano with Milk;27,92
28/09/2024;2024-09-28 09:31:14.759;card;Americano with Milk;27,92
28/09/2024;2024-09-28 14:25:47.337;card;Latte;35,76
28/09/2024;2024-09-28 16:57:20.118;card;Latte;35,76
28/09/2024;2024-09-28 17:26:16.704;card;Americano with Milk;30,86
28/09/2024;2024-09-28 20:34:31.110;card;Latte;35,76
28/09/2024;2024-09-28 20:38:36.502;card;Latte;35,76
28/09/2024;2024-09-28 22:16:36.777;card;Cappuccino;35,76
28/09/2024;2024-09-28 22:17:29.587;card;Cocoa;35,76
28/09/2024;2024-09-28 22:18:16.072;card;Cortado;25,96
